Starting Optuna optimization on REAL shark data
Started at: Tue 18 Nov 2025 05:35:20 PM EST
Running on: gpu-5-11
================================================================================
DEVICE INFORMATION
================================================================================
Using device: cuda
GPU Name: NVIDIA H100 80GB HBM3
GPU Count: 1
CUDA Version: 12.1
Current GPU: 0
GPU Memory: 79.20 GB
================================================================================

LOADING AND PREPROCESSING REAL SHARK DATA
Dataset shape: (651, 3476)
Number of classes: 57
Classes: ['Arabian smooth-hound', 'Atlantic Sharpnose shark', 'Blackchin guitarfish', 'Blacknose shark', 'Blackspotted smooth-hound', 'Blacktip reef shark', 'Blacktip shark', 'Blue shark', 'Bonnethead shark', 'Bowmouth guitarfish', 'Brownbanded bamboo shark', 'Bull shark', 'Caribbean reef shark', 'Common thresher shark', 'Copper shark', 'Dusky shark', 'Finetooth shark', 'Great hammerhead shark', 'Great white shark', 'Grey reef shark', 'Gulper shark', 'Gummy shark', 'Halavi guitarfish', 'Hooktooth shark', 'Japanese topeshark', 'Java shark', 'Lemon shark', 'Longtail stingray', 'Milk shark', 'Narrownose smooth-hound', 'Night shark', 'Nurse shark', 'Oceanic whitetip shark', 'Pacific bonnethead shark', 'Pacific guitarfish', 'Pacific smalltail shark', 'Pelagic thresher shark', 'Porbeagle shark', 'Roughskin dogfish', 'Sandbar shark', 'Sandtiger shark', 'Scalloped bonnethead shark', 'Scalloped hammerhead shark', 'Shortfin mako', 'Silky shark', 'Silvertip shark', 'Small tail shark', 'Smooth hammerhead shark', 'Spadenose stingray', 'Spinner shark', 'Spot-tail shark', 'Spotted Eagleray', 'Thornback ray', 'Tiger shark', 'Tope shark', 'Whitecheeck shark', 'Zebra shark']
Training pool size: 520
Test set size: 131

================================================================================
STARTING OPTUNA HYPERPARAMETER OPTIMIZATION - REAL DATA
================================================================================
Target: Maximize Macro F1 Score
Number of trials: 200
Database: optuna_tcn_real_study.db
================================================================================

Study created/loaded: tcn_shark_real_data
Storage: sqlite:///optuna_tcn_real_study.db
Optimization direction: maximize

[I 2025-11-18 17:37:00,536] Trial 0 finished with value: 0.39886571403599264 and parameters: {'num_layers': 6, 'base_filters': 128, 'filter_growth': 'linear', 'kernel_size': 3, 'dropout': 0.18797561901364201, 'reverse_dilation': True, 'batch_size': 32, 'learning_rate': 0.0009218522896014898, 'weight_decay': 0.0024731749116052954, 'optimizer': 'Adam', 'use_augmentation': True, 'use_scheduler': False}. Best is trial 0 with value: 0.39886571403599264.

Trial 0 finished with F1 Score: 0.3989
[I 2025-11-18 17:37:08,710] Trial 1 finished with value: 0.033235867446393765 and parameters: {'num_layers': 7, 'base_filters': 32, 'filter_growth': 'constant', 'kernel_size': 3, 'dropout': 0.2991927725660244, 'reverse_dilation': True, 'batch_size': 16, 'learning_rate': 4.577811294938125e-05, 'weight_decay': 0.00034919108984025367, 'optimizer': 'Adam', 'use_augmentation': False, 'use_scheduler': True, 'scheduler_patience': 11, 'scheduler_factor': 0.15168009425697954}. Best is trial 0 with value: 0.39886571403599264.

Trial 1 finished with F1 Score: 0.0332
[I 2025-11-18 17:38:15,364] Trial 2 finished with value: 0.46667172982962457 and parameters: {'num_layers': 6, 'base_filters': 128, 'filter_growth': 'constant', 'kernel_size': 13, 'dropout': 0.011234280127798868, 'reverse_dilation': False, 'batch_size': 8, 'learning_rate': 0.00015046333471424887, 'weight_decay': 4.1150023835965974e-05, 'optimizer': 'SGD', 'use_augmentation': True, 'use_scheduler': False}. Best is trial 2 with value: 0.46667172982962457.

Trial 2 finished with F1 Score: 0.4667
[I 2025-11-18 17:38:35,996] Trial 3 finished with value: 0.0016095284081764044 and parameters: {'num_layers': 6, 'base_filters': 128, 'filter_growth': 'exponential', 'kernel_size': 3, 'dropout': 0.4968345646181034, 'reverse_dilation': True, 'batch_size': 64, 'learning_rate': 0.00034331029068343597, 'weight_decay': 0.00061762133327572, 'optimizer': 'SGD', 'use_augmentation': False, 'use_scheduler': True, 'scheduler_patience': 9, 'scheduler_factor': 0.6692298454919512}. Best is trial 2 with value: 0.46667172982962457.

Trial 3 finished with F1 Score: 0.0016
[I 2025-11-18 17:39:05,558] Trial 4 finished with value: 0.21025107548653255 and parameters: {'num_layers': 4, 'base_filters': 64, 'filter_growth': 'linear', 'kernel_size': 3, 'dropout': 0.28893363779560327, 'reverse_dilation': False, 'batch_size': 16, 'learning_rate': 0.0008585779853569094, 'weight_decay': 0.001457821300708797, 'optimizer': 'Adam', 'use_augmentation': False, 'use_scheduler': True, 'scheduler_patience': 13, 'scheduler_factor': 0.1246889744068676}. Best is trial 2 with value: 0.46667172982962457.

Trial 4 finished with F1 Score: 0.2103
[I 2025-11-18 17:39:58,905] Trial 5 finished with value: 0.5550125313283207 and parameters: {'num_layers': 5, 'base_filters': 32, 'filter_growth': 'exponential', 'kernel_size': 5, 'dropout': 0.16759516102720906, 'reverse_dilation': True, 'batch_size': 8, 'learning_rate': 0.004182025198963729, 'weight_decay': 1.344217896782821e-05, 'optimizer': 'SGD', 'use_augmentation': False, 'use_scheduler': True, 'scheduler_patience': 5, 'scheduler_factor': 0.1708106758068662}. Best is trial 5 with value: 0.5550125313283207.

Trial 5 finished with F1 Score: 0.5550
[I 2025-11-18 17:40:12,037] Trial 6 finished with value: 0.6439761018708388 and parameters: {'num_layers': 7, 'base_filters': 64, 'filter_growth': 'constant', 'kernel_size': 3, 'dropout': 0.4668583265930598, 'reverse_dilation': True, 'batch_size': 32, 'learning_rate': 0.009497862360582693, 'weight_decay': 0.0012350060135202289, 'optimizer': 'AdamW', 'use_augmentation': False, 'use_scheduler': False}. Best is trial 6 with value: 0.6439761018708388.

Trial 6 finished with F1 Score: 0.6440
[I 2025-11-18 17:41:39,548] Trial 7 finished with value: 0.837649679754943 and parameters: {'num_layers': 7, 'base_filters': 64, 'filter_growth': 'linear', 'kernel_size': 7, 'dropout': 0.003718291412715624, 'reverse_dilation': False, 'batch_size': 32, 'learning_rate': 0.0003100918845230211, 'weight_decay': 1.2446155137589872e-06, 'optimizer': 'AdamW', 'use_augmentation': False, 'use_scheduler': False}. Best is trial 7 with value: 0.837649679754943.

Trial 7 finished with F1 Score: 0.8376
[I 2025-11-18 17:48:55,330] Trial 8 finished with value: 0.9239766081871345 and parameters: {'num_layers': 7, 'base_filters': 128, 'filter_growth': 'linear', 'kernel_size': 13, 'dropout': 0.3205784772339879, 'reverse_dilation': False, 'batch_size': 8, 'learning_rate': 2.327324037211483e-05, 'weight_decay': 1.9811687205484613e-06, 'optimizer': 'AdamW', 'use_augmentation': True, 'use_scheduler': False}. Best is trial 8 with value: 0.9239766081871345.

Trial 8 finished with F1 Score: 0.9240
[I 2025-11-18 17:49:32,925] Trial 9 finished with value: 0.7744868707717005 and parameters: {'num_layers': 5, 'base_filters': 128, 'filter_growth': 'constant', 'kernel_size': 13, 'dropout': 0.3580203245392071, 'reverse_dilation': True, 'batch_size': 16, 'learning_rate': 6.865553447614367e-05, 'weight_decay': 1.399899626070639e-06, 'optimizer': 'AdamW', 'use_augmentation': True, 'use_scheduler': False}. Best is trial 8 with value: 0.9239766081871345.

Trial 9 finished with F1 Score: 0.7745
[I 2025-11-18 17:49:48,182] Trial 10 pruned. 

Trial 10 finished with F1 Score: 0.0553
[I 2025-11-18 17:51:43,677] Trial 11 finished with value: 0.7475424672793094 and parameters: {'num_layers': 7, 'base_filters': 64, 'filter_growth': 'linear', 'kernel_size': 9, 'dropout': 0.003742653532013529, 'reverse_dilation': False, 'batch_size': 32, 'learning_rate': 1.0367690510133075e-05, 'weight_decay': 2.056884777368539e-06, 'optimizer': 'AdamW', 'use_augmentation': True, 'use_scheduler': False}. Best is trial 8 with value: 0.9239766081871345.

Trial 11 finished with F1 Score: 0.7475
[I 2025-11-18 17:52:06,607] Trial 12 pruned. 

Trial 12 finished with F1 Score: 0.1292
[I 2025-11-18 17:53:41,117] Trial 13 finished with value: 0.7813840155945418 and parameters: {'num_layers': 6, 'base_filters': 64, 'filter_growth': 'linear', 'kernel_size': 7, 'dropout': 0.0885064446291549, 'reverse_dilation': False, 'batch_size': 8, 'learning_rate': 0.0003143064564820513, 'weight_decay': 0.009458722760523728, 'optimizer': 'AdamW', 'use_augmentation': True, 'use_scheduler': False}. Best is trial 8 with value: 0.9239766081871345.

Trial 13 finished with F1 Score: 0.7814
[I 2025-11-18 17:53:46,206] Trial 14 pruned. 

Trial 14 finished with F1 Score: 0.0501
[I 2025-11-18 17:58:02,006] Trial 15 finished with value: 0.8711500974658869 and parameters: {'num_layers': 7, 'base_filters': 128, 'filter_growth': 'linear', 'kernel_size': 7, 'dropout': 0.0840371867515823, 'reverse_dilation': False, 'batch_size': 8, 'learning_rate': 0.0001301934177640649, 'weight_decay': 1.0971475256283938e-06, 'optimizer': 'AdamW', 'use_augmentation': True, 'use_scheduler': False}. Best is trial 8 with value: 0.9239766081871345.

Trial 15 finished with F1 Score: 0.8712
[I 2025-11-18 18:00:56,793] Trial 16 finished with value: 0.866617933723197 and parameters: {'num_layers': 6, 'base_filters': 128, 'filter_growth': 'exponential', 'kernel_size': 11, 'dropout': 0.11199071058337692, 'reverse_dilation': False, 'batch_size': 8, 'learning_rate': 2.5616840564243464e-05, 'weight_decay': 2.3195074600340873e-05, 'optimizer': 'AdamW', 'use_augmentation': True, 'use_scheduler': False}. Best is trial 8 with value: 0.9239766081871345.

Trial 16 finished with F1 Score: 0.8666
[I 2025-11-18 18:03:59,741] Trial 17 finished with value: 0.8076643629275209 and parameters: {'num_layers': 5, 'base_filters': 128, 'filter_growth': 'linear', 'kernel_size': 15, 'dropout': 0.3545999380155732, 'reverse_dilation': False, 'batch_size': 8, 'learning_rate': 0.00013094721010905333, 'weight_decay': 4.471209823502856e-06, 'optimizer': 'AdamW', 'use_augmentation': True, 'use_scheduler': False}. Best is trial 8 with value: 0.9239766081871345.

Trial 17 finished with F1 Score: 0.8077
[I 2025-11-18 18:04:17,844] Trial 18 pruned. 

Trial 18 finished with F1 Score: 0.0217
[I 2025-11-18 18:08:18,081] Trial 19 finished with value: 0.8601497430444799 and parameters: {'num_layers': 7, 'base_filters': 128, 'filter_growth': 'exponential', 'kernel_size': 11, 'dropout': 0.267819698163895, 'reverse_dilation': False, 'batch_size': 8, 'learning_rate': 2.267363721351696e-05, 'weight_decay': 0.00017636573096476655, 'optimizer': 'Adam', 'use_augmentation': True, 'use_scheduler': False}. Best is trial 8 with value: 0.9239766081871345.

Trial 19 finished with F1 Score: 0.8601
[I 2025-11-18 18:08:45,623] Trial 20 pruned. 

Trial 20 finished with F1 Score: 0.0349
[I 2025-11-18 18:11:40,396] Trial 21 finished with value: 0.866617933723197 and parameters: {'num_layers': 6, 'base_filters': 128, 'filter_growth': 'exponential', 'kernel_size': 11, 'dropout': 0.0960917499074215, 'reverse_dilation': False, 'batch_size': 8, 'learning_rate': 2.9541019868958923e-05, 'weight_decay': 2.6661276842942513e-05, 'optimizer': 'AdamW', 'use_augmentation': True, 'use_scheduler': False}. Best is trial 8 with value: 0.9239766081871345.

Trial 21 finished with F1 Score: 0.8666
[I 2025-11-18 18:14:06,423] Trial 22 finished with value: 0.8816764132553606 and parameters: {'num_layers': 6, 'base_filters': 128, 'filter_growth': 'exponential', 'kernel_size': 13, 'dropout': 0.058375130895139245, 'reverse_dilation': False, 'batch_size': 8, 'learning_rate': 5.568957123048014e-05, 'weight_decay': 1.018208595315177e-06, 'optimizer': 'AdamW', 'use_augmentation': True, 'use_scheduler': False}. Best is trial 8 with value: 0.9239766081871345.

Trial 22 finished with F1 Score: 0.8817
[I 2025-11-18 18:17:36,324] Trial 23 finished with value: 0.8859927596769702 and parameters: {'num_layers': 7, 'base_filters': 128, 'filter_growth': 'exponential', 'kernel_size': 13, 'dropout': 0.05735741879693281, 'reverse_dilation': False, 'batch_size': 8, 'learning_rate': 5.482736791117063e-05, 'weight_decay': 1.3180298412931215e-06, 'optimizer': 'AdamW', 'use_augmentation': True, 'use_scheduler': False}. Best is trial 8 with value: 0.9239766081871345.

Trial 23 finished with F1 Score: 0.8860
[I 2025-11-18 18:20:38,770] Trial 24 finished with value: 0.8781600465810993 and parameters: {'num_layers': 6, 'base_filters': 128, 'filter_growth': 'exponential', 'kernel_size': 13, 'dropout': 0.04067854757733179, 'reverse_dilation': False, 'batch_size': 8, 'learning_rate': 6.379360692734588e-05, 'weight_decay': 2.6379011171700134e-06, 'optimizer': 'AdamW', 'use_augmentation': True, 'use_scheduler': False}. Best is trial 8 with value: 0.9239766081871345.

Trial 24 finished with F1 Score: 0.8782
[I 2025-11-18 18:21:23,794] Trial 25 pruned. 

Trial 25 finished with F1 Score: 0.2804
[I 2025-11-18 18:22:23,261] Trial 26 pruned. 

Trial 26 finished with F1 Score: 0.4749
[I 2025-11-18 18:25:19,483] Trial 27 finished with value: 0.8684489000278475 and parameters: {'num_layers': 7, 'base_filters': 128, 'filter_growth': 'exponential', 'kernel_size': 13, 'dropout': 0.3259717834675716, 'reverse_dilation': False, 'batch_size': 8, 'learning_rate': 5.3479573839112533e-05, 'weight_decay': 2.6063948903976125e-06, 'optimizer': 'AdamW', 'use_augmentation': True, 'use_scheduler': False}. Best is trial 8 with value: 0.9239766081871345.

Trial 27 finished with F1 Score: 0.8684
[I 2025-11-18 18:26:06,765] Trial 28 pruned. 

Trial 28 finished with F1 Score: 0.0403
[I 2025-11-18 18:27:14,954] Trial 29 finished with value: 0.7373294346978556 and parameters: {'num_layers': 6, 'base_filters': 128, 'filter_growth': 'exponential', 'kernel_size': 11, 'dropout': 0.23437234714749788, 'reverse_dilation': True, 'batch_size': 16, 'learning_rate': 0.0006856757380560195, 'weight_decay': 7.811448189388624e-06, 'optimizer': 'Adam', 'use_augmentation': True, 'use_scheduler': False}. Best is trial 8 with value: 0.9239766081871345.

Trial 29 finished with F1 Score: 0.7373
[I 2025-11-18 18:29:30,514] Trial 30 finished with value: 0.8768031189083821 and parameters: {'num_layers': 7, 'base_filters': 32, 'filter_growth': 'exponential', 'kernel_size': 13, 'dropout': 0.05526952445828803, 'reverse_dilation': False, 'batch_size': 8, 'learning_rate': 1.7671408118258844e-05, 'weight_decay': 2.0509439723142013e-06, 'optimizer': 'Adam', 'use_augmentation': True, 'use_scheduler': False}. Best is trial 8 with value: 0.9239766081871345.

Trial 30 finished with F1 Score: 0.8768
[I 2025-11-18 18:31:55,902] Trial 31 finished with value: 0.8869319764056606 and parameters: {'num_layers': 6, 'base_filters': 128, 'filter_growth': 'exponential', 'kernel_size': 13, 'dropout': 0.05596858466661171, 'reverse_dilation': False, 'batch_size': 8, 'learning_rate': 3.7108990086273835e-05, 'weight_decay': 3.0388962326944668e-06, 'optimizer': 'AdamW', 'use_augmentation': True, 'use_scheduler': False}. Best is trial 8 with value: 0.9239766081871345.

Trial 31 finished with F1 Score: 0.8869
[I 2025-11-18 18:36:03,755] Trial 32 finished with value: 0.8953140426824637 and parameters: {'num_layers': 6, 'base_filters': 128, 'filter_growth': 'exponential', 'kernel_size': 15, 'dropout': 0.13857943961574315, 'reverse_dilation': False, 'batch_size': 8, 'learning_rate': 3.106837369578293e-05, 'weight_decay': 3.5947051005063728e-06, 'optimizer': 'AdamW', 'use_augmentation': True, 'use_scheduler': False}. Best is trial 8 with value: 0.9239766081871345.

Trial 32 finished with F1 Score: 0.8953
[I 2025-11-18 18:36:21,558] Trial 33 pruned. 

Trial 33 finished with F1 Score: 0.1411
[I 2025-11-18 18:38:51,690] Trial 34 finished with value: 0.9448343079922027 and parameters: {'num_layers': 6, 'base_filters': 128, 'filter_growth': 'exponential', 'kernel_size': 15, 'dropout': 0.13227365243954345, 'reverse_dilation': True, 'batch_size': 8, 'learning_rate': 3.415731020361462e-05, 'weight_decay': 3.634082696380006e-06, 'optimizer': 'AdamW', 'use_augmentation': True, 'use_scheduler': True, 'scheduler_patience': 7, 'scheduler_factor': 0.36520834230625215}. Best is trial 34 with value: 0.9448343079922027.

Trial 34 finished with F1 Score: 0.9448
[I 2025-11-18 18:39:24,820] Trial 35 pruned. 

Trial 35 finished with F1 Score: 0.0186
[I 2025-11-18 18:39:55,098] Trial 36 pruned. 

Trial 36 finished with F1 Score: 0.7143
[I 2025-11-18 18:40:14,591] Trial 37 pruned. 

Trial 37 finished with F1 Score: 0.0589
[I 2025-11-18 18:42:06,788] Trial 38 finished with value: 0.8707247917774235 and parameters: {'num_layers': 6, 'base_filters': 128, 'filter_growth': 'exponential', 'kernel_size': 15, 'dropout': 0.13686017661488853, 'reverse_dilation': True, 'batch_size': 64, 'learning_rate': 0.0001890987584981175, 'weight_decay': 0.0003598275749386563, 'optimizer': 'AdamW', 'use_augmentation': False, 'use_scheduler': True, 'scheduler_patience': 3, 'scheduler_factor': 0.26393206282947057}. Best is trial 34 with value: 0.9448343079922027.

Trial 38 finished with F1 Score: 0.8707
[I 2025-11-18 18:42:14,133] Trial 39 pruned. 

Trial 39 finished with F1 Score: 0.0342
[I 2025-11-18 18:42:49,740] Trial 40 pruned. 

Trial 40 finished with F1 Score: 0.3354
[I 2025-11-18 18:45:34,479] Trial 41 finished with value: 0.8655527708159289 and parameters: {'num_layers': 7, 'base_filters': 128, 'filter_growth': 'exponential', 'kernel_size': 13, 'dropout': 0.0344274103742932, 'reverse_dilation': False, 'batch_size': 8, 'learning_rate': 4.468141350295853e-05, 'weight_decay': 2.013415331036087e-06, 'optimizer': 'AdamW', 'use_augmentation': True, 'use_scheduler': False}. Best is trial 34 with value: 0.9448343079922027.

Trial 41 finished with F1 Score: 0.8656
[I 2025-11-18 18:48:23,096] Trial 42 finished with value: 0.9299840510366826 and parameters: {'num_layers': 7, 'base_filters': 128, 'filter_growth': 'exponential', 'kernel_size': 13, 'dropout': 0.06126158896267687, 'reverse_dilation': True, 'batch_size': 8, 'learning_rate': 3.0417795861170332e-05, 'weight_decay': 1.7190650633494583e-06, 'optimizer': 'AdamW', 'use_augmentation': True, 'use_scheduler': False}. Best is trial 34 with value: 0.9448343079922027.

Trial 42 finished with F1 Score: 0.9300
[I 2025-11-18 18:50:30,882] Trial 43 finished with value: 0.88201379517169 and parameters: {'num_layers': 6, 'base_filters': 128, 'filter_growth': 'exponential', 'kernel_size': 13, 'dropout': 0.06959346493913121, 'reverse_dilation': True, 'batch_size': 8, 'learning_rate': 1.121466757549851e-05, 'weight_decay': 3.7827556719194456e-06, 'optimizer': 'AdamW', 'use_augmentation': True, 'use_scheduler': True, 'scheduler_patience': 5, 'scheduler_factor': 0.5615056157327395}. Best is trial 34 with value: 0.9448343079922027.

Trial 43 finished with F1 Score: 0.8820
[I 2025-11-18 18:51:22,525] Trial 44 pruned. 

Trial 44 finished with F1 Score: 0.3805
[I 2025-11-18 18:53:19,011] Trial 45 finished with value: 0.8849826586668692 and parameters: {'num_layers': 7, 'base_filters': 128, 'filter_growth': 'exponential', 'kernel_size': 5, 'dropout': 0.01923543865481523, 'reverse_dilation': True, 'batch_size': 8, 'learning_rate': 1.0100483174023427e-05, 'weight_decay': 6.558475644056944e-06, 'optimizer': 'AdamW', 'use_augmentation': True, 'use_scheduler': False}. Best is trial 34 with value: 0.9448343079922027.

Trial 45 finished with F1 Score: 0.8850
[I 2025-11-18 18:53:27,601] Trial 46 pruned. 

Trial 46 finished with F1 Score: 0.3940
[I 2025-11-18 18:53:45,695] Trial 47 pruned. 

Trial 47 finished with F1 Score: 0.3719
[I 2025-11-18 18:53:51,441] Trial 48 pruned. 

Trial 48 finished with F1 Score: 0.0279
[I 2025-11-18 18:54:11,436] Trial 49 pruned. 

Trial 49 finished with F1 Score: 0.3336
[I 2025-11-18 18:56:45,657] Trial 50 finished with value: 0.8592871066555278 and parameters: {'num_layers': 7, 'base_filters': 128, 'filter_growth': 'exponential', 'kernel_size': 11, 'dropout': 0.11241032257631084, 'reverse_dilation': False, 'batch_size': 8, 'learning_rate': 4.1476725932011525e-05, 'weight_decay': 8.570467940975665e-05, 'optimizer': 'AdamW', 'use_augmentation': False, 'use_scheduler': False}. Best is trial 34 with value: 0.9448343079922027.

Trial 50 finished with F1 Score: 0.8593
[I 2025-11-18 19:01:29,218] Trial 51 finished with value: 0.9065922381711855 and parameters: {'num_layers': 7, 'base_filters': 128, 'filter_growth': 'exponential', 'kernel_size': 13, 'dropout': 0.012858073006469434, 'reverse_dilation': False, 'batch_size': 8, 'learning_rate': 5.3203538359026736e-05, 'weight_decay': 1.5788395018410347e-06, 'optimizer': 'AdamW', 'use_augmentation': True, 'use_scheduler': False}. Best is trial 34 with value: 0.9448343079922027.

Trial 51 finished with F1 Score: 0.9066
[I 2025-11-18 19:06:13,550] Trial 52 finished with value: 0.9065922381711855 and parameters: {'num_layers': 7, 'base_filters': 128, 'filter_growth': 'exponential', 'kernel_size': 13, 'dropout': 0.013913774007163676, 'reverse_dilation': False, 'batch_size': 8, 'learning_rate': 7.602123489571713e-05, 'weight_decay': 2.8175080774293e-06, 'optimizer': 'AdamW', 'use_augmentation': True, 'use_scheduler': False}. Best is trial 34 with value: 0.9448343079922027.

Trial 52 finished with F1 Score: 0.9066
[I 2025-11-18 19:10:57,252] Trial 53 finished with value: 0.9011341485025697 and parameters: {'num_layers': 7, 'base_filters': 128, 'filter_growth': 'exponential', 'kernel_size': 13, 'dropout': 0.0166951498560515, 'reverse_dilation': False, 'batch_size': 8, 'learning_rate': 7.367744089563668e-05, 'weight_decay': 1.7709533996839688e-06, 'optimizer': 'AdamW', 'use_augmentation': True, 'use_scheduler': False}. Best is trial 34 with value: 0.9448343079922027.

Trial 53 finished with F1 Score: 0.9011
[I 2025-11-18 19:13:30,508] Trial 54 pruned. 

Trial 54 finished with F1 Score: 0.7963
