[I 2025-11-18 19:17:02,408] Trial 55 finished with value: 0.8676058833953572 and parameters: {'num_layers': 7, 'base_filters': 128, 'filter_growth': 'linear', 'kernel_size': 11, 'dropout': 0.01634529494331033, 'reverse_dilation': False, 'batch_size': 64, 'learning_rate': 7.676420165454597e-05, 'weight_decay': 1.6578172550246667e-06, 'optimizer': 'AdamW', 'use_augmentation': True, 'use_scheduler': False}. Best is trial 34 with value: 0.9448343079922027.

Trial 55 finished with F1 Score: 0.8676
[I 2025-11-18 19:17:44,355] Trial 56 pruned. 

Trial 56 finished with F1 Score: 0.2077
[I 2025-11-18 19:19:14,991] Trial 57 pruned. 

Trial 57 finished with F1 Score: 0.5686
[I 2025-11-18 19:20:06,997] Trial 58 pruned. 

Trial 58 finished with F1 Score: 0.5475
[I 2025-11-18 19:22:20,026] Trial 59 finished with value: 0.9426546163388269 and parameters: {'num_layers': 7, 'base_filters': 128, 'filter_growth': 'exponential', 'kernel_size': 13, 'dropout': 2.8543577547474053e-05, 'reverse_dilation': True, 'batch_size': 8, 'learning_rate': 4.730535873232635e-05, 'weight_decay': 0.0017536787692450364, 'optimizer': 'AdamW', 'use_augmentation': True, 'use_scheduler': False}. Best is trial 34 with value: 0.9448343079922027.

Trial 59 finished with F1 Score: 0.9427
[I 2025-11-18 19:23:36,059] Trial 60 finished with value: 0.9627325890483786 and parameters: {'num_layers': 7, 'base_filters': 32, 'filter_growth': 'linear', 'kernel_size': 11, 'dropout': 0.0023468410693863063, 'reverse_dilation': True, 'batch_size': 8, 'learning_rate': 5.0892116527321965e-05, 'weight_decay': 0.0038311493721093757, 'optimizer': 'AdamW', 'use_augmentation': True, 'use_scheduler': False}. Best is trial 60 with value: 0.9627325890483786.

Trial 60 finished with F1 Score: 0.9627
[I 2025-11-18 19:23:53,537] Trial 61 pruned. 

Trial 61 finished with F1 Score: 0.5929
[I 2025-11-18 19:24:11,276] Trial 62 pruned. 

Trial 62 finished with F1 Score: 0.3770
[I 2025-11-18 19:24:27,251] Trial 63 pruned. 

Trial 63 finished with F1 Score: 0.5259
[I 2025-11-18 19:25:41,792] Trial 64 finished with value: 0.9600389863547758 and parameters: {'num_layers': 7, 'base_filters': 32, 'filter_growth': 'linear', 'kernel_size': 13, 'dropout': 0.029499764020980812, 'reverse_dilation': True, 'batch_size': 8, 'learning_rate': 6.234034124746342e-05, 'weight_decay': 0.002099865455173402, 'optimizer': 'AdamW', 'use_augmentation': True, 'use_scheduler': False}. Best is trial 60 with value: 0.9627325890483786.

Trial 64 finished with F1 Score: 0.9600
[I 2025-11-18 19:26:47,224] Trial 65 finished with value: 0.9448343079922027 and parameters: {'num_layers': 7, 'base_filters': 32, 'filter_growth': 'linear', 'kernel_size': 13, 'dropout': 0.02760098477014028, 'reverse_dilation': True, 'batch_size': 8, 'learning_rate': 5.635848416674399e-05, 'weight_decay': 0.000713906888323473, 'optimizer': 'AdamW', 'use_augmentation': True, 'use_scheduler': False}. Best is trial 60 with value: 0.9627325890483786.

Trial 65 finished with F1 Score: 0.9448
[I 2025-11-18 19:27:05,016] Trial 66 pruned. 

Trial 66 finished with F1 Score: 0.3346
[I 2025-11-18 19:27:16,448] Trial 67 pruned. 

Trial 67 finished with F1 Score: 0.3056
[I 2025-11-18 19:27:31,984] Trial 68 pruned. 

Trial 68 finished with F1 Score: 0.0920
[I 2025-11-18 19:27:49,784] Trial 69 pruned. 

Trial 69 finished with F1 Score: 0.0562
[I 2025-11-18 19:28:09,097] Trial 70 pruned. 

Trial 70 finished with F1 Score: 0.0805
[I 2025-11-18 19:28:26,855] Trial 71 pruned. 

Trial 71 finished with F1 Score: 0.5759
[I 2025-11-18 19:29:27,489] Trial 72 finished with value: 0.9600389863547758 and parameters: {'num_layers': 7, 'base_filters': 32, 'filter_growth': 'linear', 'kernel_size': 13, 'dropout': 0.027784537213722135, 'reverse_dilation': True, 'batch_size': 8, 'learning_rate': 6.089153510973659e-05, 'weight_decay': 0.0055766813800441385, 'optimizer': 'AdamW', 'use_augmentation': True, 'use_scheduler': False}. Best is trial 60 with value: 0.9627325890483786.

Trial 72 finished with F1 Score: 0.9600
[I 2025-11-18 19:29:45,088] Trial 73 pruned. 

Trial 73 finished with F1 Score: 0.5349
[I 2025-11-18 19:30:02,818] Trial 74 pruned. 

Trial 74 finished with F1 Score: 0.4098
[I 2025-11-18 19:30:16,584] Trial 75 pruned. 

Trial 75 finished with F1 Score: 0.5650
[I 2025-11-18 19:30:34,216] Trial 76 pruned. 

Trial 76 finished with F1 Score: 0.4417
[I 2025-11-18 19:30:44,699] Trial 77 pruned. 

Trial 77 finished with F1 Score: 0.1583
[I 2025-11-18 19:31:02,363] Trial 78 pruned. 

Trial 78 finished with F1 Score: 0.0598
[I 2025-11-18 19:31:10,375] Trial 79 pruned. 

Trial 79 finished with F1 Score: 0.0121
[I 2025-11-18 19:31:26,991] Trial 80 pruned. 

Trial 80 finished with F1 Score: 0.0015
[I 2025-11-18 19:32:22,665] Trial 81 finished with value: 0.9524644945697578 and parameters: {'num_layers': 7, 'base_filters': 32, 'filter_growth': 'linear', 'kernel_size': 13, 'dropout': 0.025029132980645664, 'reverse_dilation': True, 'batch_size': 8, 'learning_rate': 5.8358222201421175e-05, 'weight_decay': 0.002704536550671815, 'optimizer': 'AdamW', 'use_augmentation': True, 'use_scheduler': False}. Best is trial 60 with value: 0.9627325890483786.

Trial 81 finished with F1 Score: 0.9525
[I 2025-11-18 19:32:40,299] Trial 82 pruned. 

Trial 82 finished with F1 Score: 0.6305
[I 2025-11-18 19:32:57,970] Trial 83 pruned. 

Trial 83 finished with F1 Score: 0.1558
[I 2025-11-18 19:33:15,718] Trial 84 pruned. 

Trial 84 finished with F1 Score: 0.6074
[I 2025-11-18 19:33:42,376] Trial 85 pruned. 

Trial 85 finished with F1 Score: 0.7274
[I 2025-11-18 19:34:00,103] Trial 86 pruned. 

Trial 86 finished with F1 Score: 0.0226
[I 2025-11-18 19:34:13,588] Trial 87 pruned. 

Trial 87 finished with F1 Score: 0.1746
[I 2025-11-18 19:34:18,308] Trial 88 pruned. 

Trial 88 finished with F1 Score: 0.0196
[I 2025-11-18 19:34:39,080] Trial 89 pruned. 

Trial 89 finished with F1 Score: 0.2495
[I 2025-11-18 19:35:44,746] Trial 90 finished with value: 0.9613680666312244 and parameters: {'num_layers': 7, 'base_filters': 32, 'filter_growth': 'linear', 'kernel_size': 13, 'dropout': 0.03708769969112469, 'reverse_dilation': True, 'batch_size': 8, 'learning_rate': 6.902487174779676e-05, 'weight_decay': 0.004660591554836856, 'optimizer': 'AdamW', 'use_augmentation': True, 'use_scheduler': False}. Best is trial 60 with value: 0.9627325890483786.

Trial 90 finished with F1 Score: 0.9614
[I 2025-11-18 19:37:09,178] Trial 91 finished with value: 0.9627958785853523 and parameters: {'num_layers': 7, 'base_filters': 32, 'filter_growth': 'linear', 'kernel_size': 13, 'dropout': 0.040822678610373905, 'reverse_dilation': True, 'batch_size': 8, 'learning_rate': 6.851836070141268e-05, 'weight_decay': 0.005201619280566437, 'optimizer': 'AdamW', 'use_augmentation': True, 'use_scheduler': False}. Best is trial 91 with value: 0.9627958785853523.

Trial 91 finished with F1 Score: 0.9628
[I 2025-11-18 19:38:09,869] Trial 92 finished with value: 0.9389863547758284 and parameters: {'num_layers': 7, 'base_filters': 32, 'filter_growth': 'linear', 'kernel_size': 13, 'dropout': 0.03914544631453583, 'reverse_dilation': True, 'batch_size': 8, 'learning_rate': 6.681803336048951e-05, 'weight_decay': 0.004556516433477993, 'optimizer': 'AdamW', 'use_augmentation': True, 'use_scheduler': False}. Best is trial 91 with value: 0.9627958785853523.

Trial 92 finished with F1 Score: 0.9390
[I 2025-11-18 19:39:11,198] Trial 93 finished with value: 0.9565302144249513 and parameters: {'num_layers': 7, 'base_filters': 32, 'filter_growth': 'linear', 'kernel_size': 13, 'dropout': 0.0358632116386919, 'reverse_dilation': True, 'batch_size': 8, 'learning_rate': 0.00010579056853228489, 'weight_decay': 0.004567383974868338, 'optimizer': 'AdamW', 'use_augmentation': True, 'use_scheduler': False}. Best is trial 91 with value: 0.9627958785853523.

Trial 93 finished with F1 Score: 0.9565
[I 2025-11-18 19:40:10,787] Trial 94 finished with value: 0.9458368142578668 and parameters: {'num_layers': 7, 'base_filters': 32, 'filter_growth': 'linear', 'kernel_size': 13, 'dropout': 0.001640429065155876, 'reverse_dilation': True, 'batch_size': 8, 'learning_rate': 9.600354983361593e-05, 'weight_decay': 0.006368943151592782, 'optimizer': 'AdamW', 'use_augmentation': True, 'use_scheduler': False}. Best is trial 91 with value: 0.9627958785853523.

Trial 94 finished with F1 Score: 0.9458
[I 2025-11-18 19:41:14,512] Trial 95 finished with value: 0.9600389863547758 and parameters: {'num_layers': 7, 'base_filters': 32, 'filter_growth': 'linear', 'kernel_size': 13, 'dropout': 0.023644145207529416, 'reverse_dilation': True, 'batch_size': 8, 'learning_rate': 0.00010440143804717008, 'weight_decay': 0.006070397739658763, 'optimizer': 'AdamW', 'use_augmentation': True, 'use_scheduler': False}. Best is trial 91 with value: 0.9627958785853523.

Trial 95 finished with F1 Score: 0.9600
[I 2025-11-18 19:41:32,263] Trial 96 pruned. 

Trial 96 finished with F1 Score: 0.5371
[I 2025-11-18 19:41:51,746] Trial 97 pruned. 

Trial 97 finished with F1 Score: 0.7792
[I 2025-11-18 19:42:05,135] Trial 98 pruned. 

Trial 98 finished with F1 Score: 0.3705
[I 2025-11-18 19:42:24,136] Trial 99 pruned. 

Trial 99 finished with F1 Score: 0.5588
[I 2025-11-18 19:42:38,257] Trial 100 pruned. 

Trial 100 finished with F1 Score: 0.5611
[I 2025-11-18 19:44:03,273] Trial 101 finished with value: 0.9637072479177743 and parameters: {'num_layers': 7, 'base_filters': 32, 'filter_growth': 'linear', 'kernel_size': 13, 'dropout': 0.025917936807489973, 'reverse_dilation': True, 'batch_size': 8, 'learning_rate': 8.474403387125218e-05, 'weight_decay': 0.00599869807346155, 'optimizer': 'AdamW', 'use_augmentation': True, 'use_scheduler': False}. Best is trial 101 with value: 0.9637072479177743.

Trial 101 finished with F1 Score: 0.9637
[I 2025-11-18 19:45:09,733] Trial 102 finished with value: 0.9656211235158604 and parameters: {'num_layers': 7, 'base_filters': 32, 'filter_growth': 'linear', 'kernel_size': 13, 'dropout': 0.023493586151459942, 'reverse_dilation': True, 'batch_size': 8, 'learning_rate': 8.342728464216577e-05, 'weight_decay': 0.005725369186559496, 'optimizer': 'AdamW', 'use_augmentation': True, 'use_scheduler': False}. Best is trial 102 with value: 0.9656211235158604.

Trial 102 finished with F1 Score: 0.9656
[I 2025-11-18 19:46:15,846] Trial 103 finished with value: 0.9401825270246322 and parameters: {'num_layers': 7, 'base_filters': 32, 'filter_growth': 'linear', 'kernel_size': 13, 'dropout': 0.011546915930725096, 'reverse_dilation': True, 'batch_size': 8, 'learning_rate': 8.493081945051564e-05, 'weight_decay': 0.007962219288578258, 'optimizer': 'AdamW', 'use_augmentation': True, 'use_scheduler': False}. Best is trial 102 with value: 0.9656211235158604.

Trial 103 finished with F1 Score: 0.9402
[I 2025-11-18 19:47:35,654] Trial 104 finished with value: 0.9247841826789196 and parameters: {'num_layers': 7, 'base_filters': 32, 'filter_growth': 'linear', 'kernel_size': 13, 'dropout': 0.024834668563518573, 'reverse_dilation': True, 'batch_size': 8, 'learning_rate': 0.00016417318264619332, 'weight_decay': 0.005493205030085018, 'optimizer': 'AdamW', 'use_augmentation': True, 'use_scheduler': False}. Best is trial 102 with value: 0.9656211235158604.

Trial 104 finished with F1 Score: 0.9248
[I 2025-11-18 19:48:08,548] Trial 105 pruned. 

Trial 105 finished with F1 Score: 0.8274
[I 2025-11-18 19:48:26,239] Trial 106 pruned. 

Trial 106 finished with F1 Score: 0.6361
[I 2025-11-18 19:49:12,668] Trial 107 finished with value: 0.8816688185109239 and parameters: {'num_layers': 7, 'base_filters': 32, 'filter_growth': 'linear', 'kernel_size': 13, 'dropout': 0.00014874739611777169, 'reverse_dilation': True, 'batch_size': 8, 'learning_rate': 0.0001370750856179509, 'weight_decay': 0.006296601854356563, 'optimizer': 'AdamW', 'use_augmentation': True, 'use_scheduler': False}. Best is trial 102 with value: 0.9656211235158604.

Trial 107 finished with F1 Score: 0.8817
[I 2025-11-18 19:49:30,367] Trial 108 pruned. 

Trial 108 finished with F1 Score: 0.0685
[I 2025-11-18 19:49:42,697] Trial 109 pruned. 

Trial 109 finished with F1 Score: 0.5669
[I 2025-11-18 19:50:00,590] Trial 110 pruned. 

Trial 110 finished with F1 Score: 0.5828
[I 2025-11-18 19:50:27,710] Trial 111 pruned. 

Trial 111 finished with F1 Score: 0.7510
[I 2025-11-18 19:51:21,718] Trial 112 finished with value: 0.9198475987949672 and parameters: {'num_layers': 7, 'base_filters': 32, 'filter_growth': 'linear', 'kernel_size': 13, 'dropout': 0.008818772677907292, 'reverse_dilation': True, 'batch_size': 8, 'learning_rate': 0.00011856550259938628, 'weight_decay': 0.005737811584763487, 'optimizer': 'AdamW', 'use_augmentation': True, 'use_scheduler': True, 'scheduler_patience': 13, 'scheduler_factor': 0.4526996622401716}. Best is trial 102 with value: 0.9656211235158604.

Trial 112 finished with F1 Score: 0.9198
[I 2025-11-18 19:51:39,214] Trial 113 pruned. 

Trial 113 finished with F1 Score: 0.5675
[I 2025-11-18 19:51:58,567] Trial 114 pruned. 

Trial 114 finished with F1 Score: 0.5434
[I 2025-11-18 19:52:16,275] Trial 115 pruned. 

Trial 115 finished with F1 Score: 0.6043
[I 2025-11-18 19:52:29,971] Trial 116 pruned. 

Trial 116 finished with F1 Score: 0.6321
[I 2025-11-18 19:52:47,372] Trial 117 pruned. 

Trial 117 finished with F1 Score: 0.3944
[I 2025-11-18 19:52:54,903] Trial 118 pruned. 

Trial 118 finished with F1 Score: 0.2062
[I 2025-11-18 19:54:24,465] Trial 119 finished with value: 0.95629224576593 and parameters: {'num_layers': 7, 'base_filters': 32, 'filter_growth': 'linear', 'kernel_size': 15, 'dropout': 0.022065858688215624, 'reverse_dilation': True, 'batch_size': 8, 'learning_rate': 6.234925016205558e-05, 'weight_decay': 0.0047036298435674, 'optimizer': 'AdamW', 'use_augmentation': True, 'use_scheduler': False}. Best is trial 102 with value: 0.9656211235158604.

Trial 119 finished with F1 Score: 0.9563
[I 2025-11-18 19:54:37,291] Trial 120 pruned. 

Trial 120 finished with F1 Score: 0.6119
[I 2025-11-18 19:54:58,479] Trial 121 pruned. 

Trial 121 finished with F1 Score: 0.6061
[I 2025-11-18 19:55:56,275] Trial 122 finished with value: 0.9247208931419458 and parameters: {'num_layers': 7, 'base_filters': 32, 'filter_growth': 'linear', 'kernel_size': 15, 'dropout': 0.01940832259358133, 'reverse_dilation': True, 'batch_size': 8, 'learning_rate': 6.199017175746712e-05, 'weight_decay': 0.006050825125669734, 'optimizer': 'AdamW', 'use_augmentation': True, 'use_scheduler': False}. Best is trial 102 with value: 0.9656211235158604.

Trial 122 finished with F1 Score: 0.9247
[I 2025-11-18 19:56:15,609] Trial 123 pruned. 

Trial 123 finished with F1 Score: 0.6212
[I 2025-11-18 19:56:34,962] Trial 124 pruned. 

Trial 124 finished with F1 Score: 0.6293
[I 2025-11-18 19:56:46,126] Trial 125 pruned. 

Trial 125 finished with F1 Score: 0.4007
[I 2025-11-18 19:57:03,927] Trial 126 pruned. 

Trial 126 finished with F1 Score: 0.5793
[I 2025-11-18 19:57:23,311] Trial 127 pruned. 

Trial 127 finished with F1 Score: 0.6307
[I 2025-11-18 19:59:37,428] Trial 128 finished with value: 0.9409002303739147 and parameters: {'num_layers': 7, 'base_filters': 64, 'filter_growth': 'linear', 'kernel_size': 13, 'dropout': 0.045776543116399324, 'reverse_dilation': True, 'batch_size': 8, 'learning_rate': 7.93008582654225e-05, 'weight_decay': 0.002123538461311188, 'optimizer': 'AdamW', 'use_augmentation': True, 'use_scheduler': False}. Best is trial 102 with value: 0.9656211235158604.

Trial 128 finished with F1 Score: 0.9409
[I 2025-11-18 19:59:55,138] Trial 129 pruned. 

Trial 129 finished with F1 Score: 0.0148
[I 2025-11-18 20:00:12,811] Trial 130 pruned. 

Trial 130 finished with F1 Score: 0.4841
[I 2025-11-18 20:01:13,354] Trial 131 finished with value: 0.9571150097465887 and parameters: {'num_layers': 7, 'base_filters': 32, 'filter_growth': 'linear', 'kernel_size': 13, 'dropout': 0.02554406919251721, 'reverse_dilation': True, 'batch_size': 8, 'learning_rate': 6.177939866150751e-05, 'weight_decay': 0.0037879667414164172, 'optimizer': 'AdamW', 'use_augmentation': True, 'use_scheduler': False}. Best is trial 102 with value: 0.9656211235158604.

Trial 131 finished with F1 Score: 0.9571
[I 2025-11-18 20:02:20,338] Trial 132 finished with value: 0.9399888610414926 and parameters: {'num_layers': 7, 'base_filters': 32, 'filter_growth': 'linear', 'kernel_size': 13, 'dropout': 0.028330111585736, 'reverse_dilation': True, 'batch_size': 8, 'learning_rate': 7.106575491236474e-05, 'weight_decay': 0.0036503701662728306, 'optimizer': 'AdamW', 'use_augmentation': True, 'use_scheduler': False}. Best is trial 102 with value: 0.9656211235158604.

Trial 132 finished with F1 Score: 0.9400
[I 2025-11-18 20:02:49,786] Trial 133 pruned. 

Trial 133 finished with F1 Score: 0.8139
[I 2025-11-18 20:03:09,156] Trial 134 pruned. 

Trial 134 finished with F1 Score: 0.6140
[I 2025-11-18 20:04:32,835] Trial 135 finished with value: 0.9613680666312244 and parameters: {'num_layers': 7, 'base_filters': 32, 'filter_growth': 'linear', 'kernel_size': 13, 'dropout': 0.04134027432989137, 'reverse_dilation': True, 'batch_size': 8, 'learning_rate': 9.018930536897613e-05, 'weight_decay': 0.002456440093671778, 'optimizer': 'AdamW', 'use_augmentation': True, 'use_scheduler': False}. Best is trial 102 with value: 0.9656211235158604.

Trial 135 finished with F1 Score: 0.9614
[I 2025-11-18 20:04:52,205] Trial 136 pruned. 

Trial 136 finished with F1 Score: 0.6487
[I 2025-11-18 20:05:04,518] Trial 137 pruned. 

Trial 137 finished with F1 Score: 0.5751
[I 2025-11-18 20:06:28,353] Trial 138 finished with value: 0.9540239487607909 and parameters: {'num_layers': 7, 'base_filters': 32, 'filter_growth': 'linear', 'kernel_size': 13, 'dropout': 0.032418727548035174, 'reverse_dilation': True, 'batch_size': 8, 'learning_rate': 9.192306737592712e-05, 'weight_decay': 0.007974033867247645, 'optimizer': 'AdamW', 'use_augmentation': True, 'use_scheduler': False}. Best is trial 102 with value: 0.9656211235158604.

Trial 138 finished with F1 Score: 0.9540
[I 2025-11-18 20:06:52,136] Trial 139 pruned. 

Trial 139 finished with F1 Score: 0.7255
[I 2025-11-18 20:07:05,822] Trial 140 pruned. 

Trial 140 finished with F1 Score: 0.6309
[I 2025-11-18 20:07:55,243] Trial 141 finished with value: 0.9296296296296297 and parameters: {'num_layers': 7, 'base_filters': 32, 'filter_growth': 'linear', 'kernel_size': 13, 'dropout': 0.02113052854160601, 'reverse_dilation': True, 'batch_size': 8, 'learning_rate': 9.33803708788491e-05, 'weight_decay': 0.006707640367436466, 'optimizer': 'AdamW', 'use_augmentation': True, 'use_scheduler': False}. Best is trial 102 with value: 0.9656211235158604.

Trial 141 finished with F1 Score: 0.9296
[I 2025-11-18 20:08:14,581] Trial 142 pruned. 

Trial 142 finished with F1 Score: 0.6439
[I 2025-11-18 20:09:16,564] Trial 143 finished with value: 0.9193957115009745 and parameters: {'num_layers': 7, 'base_filters': 32, 'filter_growth': 'linear', 'kernel_size': 13, 'dropout': 0.0008017879325228403, 'reverse_dilation': True, 'batch_size': 8, 'learning_rate': 6.0381819443895575e-05, 'weight_decay': 0.007550888643107314, 'optimizer': 'AdamW', 'use_augmentation': True, 'use_scheduler': False}. Best is trial 102 with value: 0.9656211235158604.

Trial 143 finished with F1 Score: 0.9194
[I 2025-11-18 20:09:24,504] Trial 144 pruned. 

Trial 144 finished with F1 Score: 0.1253
[I 2025-11-18 20:09:42,171] Trial 145 pruned. 

Trial 145 finished with F1 Score: 0.6154
[I 2025-11-18 20:09:50,089] Trial 146 pruned. 

Trial 146 finished with F1 Score: 0.3809
[I 2025-11-18 20:10:05,976] Trial 147 pruned. 

Trial 147 finished with F1 Score: 0.6048
[I 2025-11-18 20:10:23,671] Trial 148 pruned. 

Trial 148 finished with F1 Score: 0.6483
[I 2025-11-18 20:10:36,378] Trial 149 pruned. 

Trial 149 finished with F1 Score: 0.0248
[I 2025-11-18 20:10:55,704] Trial 150 pruned. 

Trial 150 finished with F1 Score: 0.6449
[I 2025-11-18 20:11:15,007] Trial 151 pruned. 

Trial 151 finished with F1 Score: 0.5286
[I 2025-11-18 20:13:04,059] Trial 152 finished with value: 0.9350877192982455 and parameters: {'num_layers': 7, 'base_filters': 64, 'filter_growth': 'linear', 'kernel_size': 7, 'dropout': 0.015569608283102172, 'reverse_dilation': True, 'batch_size': 8, 'learning_rate': 4.2200214163698964e-05, 'weight_decay': 0.005033997287822046, 'optimizer': 'AdamW', 'use_augmentation': True, 'use_scheduler': False}. Best is trial 102 with value: 0.9656211235158604.

Trial 152 finished with F1 Score: 0.9351
[I 2025-11-18 20:13:23,433] Trial 153 pruned. 

Trial 153 finished with F1 Score: 0.6575
[I 2025-11-18 20:13:37,777] Trial 154 pruned. 

Trial 154 finished with F1 Score: 0.2767
[I 2025-11-18 20:13:55,421] Trial 155 pruned. 

Trial 155 finished with F1 Score: 0.6543
[I 2025-11-18 20:15:18,835] Trial 156 finished with value: 0.9613680666312244 and parameters: {'num_layers': 7, 'base_filters': 32, 'filter_growth': 'linear', 'kernel_size': 13, 'dropout': 0.006794650840406737, 'reverse_dilation': True, 'batch_size': 8, 'learning_rate': 8.013677366467186e-05, 'weight_decay': 0.001502870440151405, 'optimizer': 'AdamW', 'use_augmentation': True, 'use_scheduler': False}. Best is trial 102 with value: 0.9656211235158604.

Trial 156 finished with F1 Score: 0.9614
[I 2025-11-18 20:15:39,799] Trial 157 pruned. 

Trial 157 finished with F1 Score: 0.7248
[I 2025-11-18 20:15:57,329] Trial 158 pruned. 

Trial 158 finished with F1 Score: 0.1310
[I 2025-11-18 20:16:14,693] Trial 159 pruned. 

Trial 159 finished with F1 Score: 0.0017
