[I 2025-11-18 20:17:38,391] Trial 160 finished with value: 0.9658869395711501 and parameters: {'num_layers': 7, 'base_filters': 32, 'filter_growth': 'linear', 'kernel_size': 13, 'dropout': 0.02208528755253426, 'reverse_dilation': True, 'batch_size': 8, 'learning_rate': 9.29558217542935e-05, 'weight_decay': 0.0044478395955166086, 'optimizer': 'AdamW', 'use_augmentation': True, 'use_scheduler': False}. Best is trial 160 with value: 0.9658869395711501.

Trial 160 finished with F1 Score: 0.9659
[I 2025-11-18 20:18:38,615] Trial 161 finished with value: 0.9348851927799295 and parameters: {'num_layers': 7, 'base_filters': 32, 'filter_growth': 'linear', 'kernel_size': 13, 'dropout': 0.02119643280360256, 'reverse_dilation': True, 'batch_size': 8, 'learning_rate': 9.330190374363127e-05, 'weight_decay': 0.005500387707387866, 'optimizer': 'AdamW', 'use_augmentation': True, 'use_scheduler': False}. Best is trial 160 with value: 0.9658869395711501.

Trial 161 finished with F1 Score: 0.9349
[I 2025-11-18 20:18:56,288] Trial 162 pruned. 

Trial 162 finished with F1 Score: 0.6140
[I 2025-11-18 20:20:00,683] Trial 163 finished with value: 0.942495126705653 and parameters: {'num_layers': 7, 'base_filters': 32, 'filter_growth': 'linear', 'kernel_size': 13, 'dropout': 0.010142243778304886, 'reverse_dilation': True, 'batch_size': 8, 'learning_rate': 0.00010707524861287871, 'weight_decay': 0.004396834463989353, 'optimizer': 'AdamW', 'use_augmentation': True, 'use_scheduler': False}. Best is trial 160 with value: 0.9658869395711501.

Trial 163 finished with F1 Score: 0.9425
[I 2025-11-18 20:20:20,044] Trial 164 pruned. 

Trial 164 finished with F1 Score: 0.6502
[I 2025-11-18 20:20:37,686] Trial 165 pruned. 

Trial 165 finished with F1 Score: 0.6352
[I 2025-11-18 20:21:07,033] Trial 166 pruned. 

Trial 166 finished with F1 Score: 0.8152
[I 2025-11-18 20:21:18,979] Trial 167 pruned. 

Trial 167 finished with F1 Score: 0.3843
[I 2025-11-18 20:22:42,854] Trial 168 finished with value: 0.9413255360623781 and parameters: {'num_layers': 7, 'base_filters': 32, 'filter_growth': 'linear', 'kernel_size': 13, 'dropout': 0.028048392387041994, 'reverse_dilation': True, 'batch_size': 8, 'learning_rate': 8.04912790715692e-05, 'weight_decay': 0.0024042757185371725, 'optimizer': 'AdamW', 'use_augmentation': True, 'use_scheduler': False}. Best is trial 160 with value: 0.9658869395711501.

Trial 168 finished with F1 Score: 0.9413
[I 2025-11-18 20:23:00,372] Trial 169 pruned. 

Trial 169 finished with F1 Score: 0.5194
[I 2025-11-18 20:23:18,249] Trial 170 pruned. 

Trial 170 finished with F1 Score: 0.6329
[I 2025-11-18 20:23:26,264] Trial 171 pruned. 

Trial 171 finished with F1 Score: 0.2338
[I 2025-11-18 20:23:45,627] Trial 172 pruned. 

Trial 172 finished with F1 Score: 0.3110
[I 2025-11-18 20:24:03,330] Trial 173 pruned. 

Trial 173 finished with F1 Score: 0.2810
[I 2025-11-18 20:25:04,982] Trial 174 finished with value: 0.9337231968810916 and parameters: {'num_layers': 7, 'base_filters': 32, 'filter_growth': 'linear', 'kernel_size': 13, 'dropout': 0.040508190171448, 'reverse_dilation': True, 'batch_size': 8, 'learning_rate': 7.691118144513452e-05, 'weight_decay': 0.0019300732326539844, 'optimizer': 'AdamW', 'use_augmentation': True, 'use_scheduler': False}. Best is trial 160 with value: 0.9658869395711501.

Trial 174 finished with F1 Score: 0.9337
[I 2025-11-18 20:25:22,855] Trial 175 pruned. 

Trial 175 finished with F1 Score: 0.6150
[I 2025-11-18 20:27:26,751] Trial 176 finished with value: 0.9410331384015594 and parameters: {'num_layers': 7, 'base_filters': 64, 'filter_growth': 'linear', 'kernel_size': 15, 'dropout': 0.02857673016971255, 'reverse_dilation': True, 'batch_size': 16, 'learning_rate': 9.891221550626731e-05, 'weight_decay': 0.0036157672480669058, 'optimizer': 'AdamW', 'use_augmentation': True, 'use_scheduler': True, 'scheduler_patience': 12, 'scheduler_factor': 0.444983001122215}. Best is trial 160 with value: 0.9658869395711501.

Trial 176 finished with F1 Score: 0.9410
[I 2025-11-18 20:30:30,776] Trial 177 finished with value: 0.9618212197159567 and parameters: {'num_layers': 7, 'base_filters': 32, 'filter_growth': 'exponential', 'kernel_size': 13, 'dropout': 0.00901849223671607, 'reverse_dilation': True, 'batch_size': 8, 'learning_rate': 8.41256334350386e-05, 'weight_decay': 0.002926257274154874, 'optimizer': 'Adam', 'use_augmentation': True, 'use_scheduler': False}. Best is trial 160 with value: 0.9658869395711501.

Trial 177 finished with F1 Score: 0.9618
[I 2025-11-18 20:30:55,243] Trial 178 pruned. 

Trial 178 finished with F1 Score: 0.7710
[I 2025-11-18 20:31:13,055] Trial 179 pruned. 

Trial 179 finished with F1 Score: 0.6257
[I 2025-11-18 20:33:18,049] Trial 180 finished with value: 0.9343003974582922 and parameters: {'num_layers': 7, 'base_filters': 32, 'filter_growth': 'exponential', 'kernel_size': 13, 'dropout': 0.016160615978032363, 'reverse_dilation': True, 'batch_size': 32, 'learning_rate': 9.316292717677835e-05, 'weight_decay': 0.0046725430558706696, 'optimizer': 'Adam', 'use_augmentation': True, 'use_scheduler': False}. Best is trial 160 with value: 0.9658869395711501.

Trial 180 finished with F1 Score: 0.9343
[I 2025-11-18 20:35:58,006] Trial 181 finished with value: 0.956947925368978 and parameters: {'num_layers': 7, 'base_filters': 32, 'filter_growth': 'exponential', 'kernel_size': 13, 'dropout': 0.034795966690185455, 'reverse_dilation': True, 'batch_size': 8, 'learning_rate': 6.876570715858216e-05, 'weight_decay': 0.0025987141688996345, 'optimizer': 'Adam', 'use_augmentation': True, 'use_scheduler': False}. Best is trial 160 with value: 0.9658869395711501.

Trial 181 finished with F1 Score: 0.9569
[I 2025-11-18 20:39:01,465] Trial 182 finished with value: 0.9623781676413256 and parameters: {'num_layers': 7, 'base_filters': 32, 'filter_growth': 'exponential', 'kernel_size': 13, 'dropout': 0.03726261208827265, 'reverse_dilation': True, 'batch_size': 8, 'learning_rate': 6.967124023739433e-05, 'weight_decay': 0.002434366066341198, 'optimizer': 'Adam', 'use_augmentation': True, 'use_scheduler': False}. Best is trial 160 with value: 0.9658869395711501.

Trial 182 finished with F1 Score: 0.9624
[I 2025-11-18 20:40:35,048] Trial 183 finished with value: 0.8916179337231969 and parameters: {'num_layers': 7, 'base_filters': 32, 'filter_growth': 'exponential', 'kernel_size': 13, 'dropout': 0.0459914433301635, 'reverse_dilation': True, 'batch_size': 8, 'learning_rate': 6.271178211619255e-05, 'weight_decay': 0.0024544693572685124, 'optimizer': 'Adam', 'use_augmentation': True, 'use_scheduler': False}. Best is trial 160 with value: 0.9658869395711501.

Trial 183 finished with F1 Score: 0.8916
[I 2025-11-18 20:42:56,236] Trial 184 finished with value: 0.9512670565302144 and parameters: {'num_layers': 7, 'base_filters': 32, 'filter_growth': 'exponential', 'kernel_size': 13, 'dropout': 0.03533358649825906, 'reverse_dilation': True, 'batch_size': 8, 'learning_rate': 6.92486640514943e-05, 'weight_decay': 0.001582936835946566, 'optimizer': 'Adam', 'use_augmentation': True, 'use_scheduler': False}. Best is trial 160 with value: 0.9658869395711501.

Trial 184 finished with F1 Score: 0.9513
[I 2025-11-18 20:44:44,505] Trial 185 finished with value: 0.9343003974582922 and parameters: {'num_layers': 7, 'base_filters': 32, 'filter_growth': 'exponential', 'kernel_size': 13, 'dropout': 0.03205762972221457, 'reverse_dilation': True, 'batch_size': 8, 'learning_rate': 5.1827830127090925e-05, 'weight_decay': 0.0029151436514003233, 'optimizer': 'Adam', 'use_augmentation': True, 'use_scheduler': False}. Best is trial 160 with value: 0.9658869395711501.

Trial 185 finished with F1 Score: 0.9343
[I 2025-11-18 20:46:18,130] Trial 186 finished with value: 0.9358952937900307 and parameters: {'num_layers': 7, 'base_filters': 32, 'filter_growth': 'exponential', 'kernel_size': 13, 'dropout': 0.04225846319809665, 'reverse_dilation': True, 'batch_size': 8, 'learning_rate': 7.355652466754784e-05, 'weight_decay': 0.0033590923656506744, 'optimizer': 'Adam', 'use_augmentation': True, 'use_scheduler': False}. Best is trial 160 with value: 0.9658869395711501.

Trial 186 finished with F1 Score: 0.9359
[I 2025-11-18 20:47:51,691] Trial 187 finished with value: 0.8922027290448343 and parameters: {'num_layers': 7, 'base_filters': 32, 'filter_growth': 'exponential', 'kernel_size': 13, 'dropout': 0.05203127059193208, 'reverse_dilation': True, 'batch_size': 8, 'learning_rate': 5.923913076801142e-05, 'weight_decay': 0.002009906507219134, 'optimizer': 'Adam', 'use_augmentation': True, 'use_scheduler': False}. Best is trial 160 with value: 0.9658869395711501.

Trial 187 finished with F1 Score: 0.8922
[I 2025-11-18 20:50:22,102] Trial 188 finished with value: 0.9394040657198551 and parameters: {'num_layers': 7, 'base_filters': 32, 'filter_growth': 'exponential', 'kernel_size': 13, 'dropout': 0.06856397567711797, 'reverse_dilation': True, 'batch_size': 8, 'learning_rate': 8.621743759370027e-05, 'weight_decay': 0.0013516340363389362, 'optimizer': 'Adam', 'use_augmentation': True, 'use_scheduler': False}. Best is trial 160 with value: 0.9658869395711501.

Trial 188 finished with F1 Score: 0.9394
[I 2025-11-18 20:50:31,857] Trial 189 pruned. 

Trial 189 finished with F1 Score: 0.2129
[I 2025-11-18 20:53:35,350] Trial 190 finished with value: 0.9594541910331384 and parameters: {'num_layers': 7, 'base_filters': 32, 'filter_growth': 'exponential', 'kernel_size': 13, 'dropout': 0.01713209547658645, 'reverse_dilation': True, 'batch_size': 8, 'learning_rate': 6.388281242333516e-05, 'weight_decay': 0.003927439260640724, 'optimizer': 'Adam', 'use_augmentation': True, 'use_scheduler': False}. Best is trial 160 with value: 0.9658869395711501.

Trial 190 finished with F1 Score: 0.9595
[I 2025-11-18 20:55:01,606] Trial 191 finished with value: 0.9530492898913953 and parameters: {'num_layers': 7, 'base_filters': 32, 'filter_growth': 'exponential', 'kernel_size': 13, 'dropout': 0.019261834639506065, 'reverse_dilation': True, 'batch_size': 8, 'learning_rate': 6.420323574647469e-05, 'weight_decay': 0.0039123703497263365, 'optimizer': 'Adam', 'use_augmentation': True, 'use_scheduler': False}. Best is trial 160 with value: 0.9658869395711501.

Trial 191 finished with F1 Score: 0.9530
[I 2025-11-18 20:56:35,203] Trial 192 finished with value: 0.9372243740664793 and parameters: {'num_layers': 7, 'base_filters': 32, 'filter_growth': 'exponential', 'kernel_size': 13, 'dropout': 0.016254346300950594, 'reverse_dilation': True, 'batch_size': 8, 'learning_rate': 8.375719522125011e-05, 'weight_decay': 0.003963570011842575, 'optimizer': 'Adam', 'use_augmentation': True, 'use_scheduler': False}. Best is trial 160 with value: 0.9658869395711501.

Trial 192 finished with F1 Score: 0.9372
[I 2025-11-18 20:58:28,920] Trial 193 finished with value: 0.9631502999924052 and parameters: {'num_layers': 7, 'base_filters': 32, 'filter_growth': 'exponential', 'kernel_size': 13, 'dropout': 0.007948141598221124, 'reverse_dilation': True, 'batch_size': 8, 'learning_rate': 6.664436081428724e-05, 'weight_decay': 0.004816897391207906, 'optimizer': 'Adam', 'use_augmentation': True, 'use_scheduler': False}. Best is trial 160 with value: 0.9658869395711501.

Trial 193 finished with F1 Score: 0.9632
[I 2025-11-18 21:01:14,118] Trial 194 finished with value: 0.9637072479177743 and parameters: {'num_layers': 7, 'base_filters': 32, 'filter_growth': 'exponential', 'kernel_size': 13, 'dropout': 0.0005949337440479298, 'reverse_dilation': True, 'batch_size': 8, 'learning_rate': 5.098268701303711e-05, 'weight_decay': 0.0045217550133677675, 'optimizer': 'Adam', 'use_augmentation': True, 'use_scheduler': False}. Best is trial 160 with value: 0.9658869395711501.

Trial 194 finished with F1 Score: 0.9637
[I 2025-11-18 21:03:33,723] Trial 195 finished with value: 0.9549353180932129 and parameters: {'num_layers': 7, 'base_filters': 32, 'filter_growth': 'exponential', 'kernel_size': 13, 'dropout': 0.007725751930128327, 'reverse_dilation': True, 'batch_size': 8, 'learning_rate': 4.2820202667764495e-05, 'weight_decay': 0.0049626064294745744, 'optimizer': 'Adam', 'use_augmentation': True, 'use_scheduler': False}. Best is trial 160 with value: 0.9658869395711501.

Trial 195 finished with F1 Score: 0.9549
[I 2025-11-18 21:05:53,214] Trial 196 finished with value: 0.9598719019771652 and parameters: {'num_layers': 7, 'base_filters': 32, 'filter_growth': 'exponential', 'kernel_size': 13, 'dropout': 0.00638874676895992, 'reverse_dilation': True, 'batch_size': 8, 'learning_rate': 5.220097860855027e-05, 'weight_decay': 0.0035102619422515188, 'optimizer': 'Adam', 'use_augmentation': True, 'use_scheduler': False}. Best is trial 160 with value: 0.9658869395711501.

Trial 196 finished with F1 Score: 0.9599
[I 2025-11-18 21:07:28,609] Trial 197 finished with value: 0.9228272701956913 and parameters: {'num_layers': 7, 'base_filters': 32, 'filter_growth': 'exponential', 'kernel_size': 13, 'dropout': 0.0010666294195223437, 'reverse_dilation': True, 'batch_size': 8, 'learning_rate': 5.0229856894824875e-05, 'weight_decay': 0.0033038227252415436, 'optimizer': 'Adam', 'use_augmentation': True, 'use_scheduler': False}. Best is trial 160 with value: 0.9658869395711501.

Trial 197 finished with F1 Score: 0.9228
[I 2025-11-18 21:09:33,741] Trial 198 finished with value: 0.9576922103237893 and parameters: {'num_layers': 7, 'base_filters': 32, 'filter_growth': 'exponential', 'kernel_size': 13, 'dropout': 0.007611265409496327, 'reverse_dilation': True, 'batch_size': 8, 'learning_rate': 5.028213280601516e-05, 'weight_decay': 0.0028283976077162066, 'optimizer': 'Adam', 'use_augmentation': False, 'use_scheduler': False}. Best is trial 160 with value: 0.9658869395711501.

Trial 198 finished with F1 Score: 0.9577
[I 2025-11-18 21:10:51,765] Trial 199 finished with value: 0.9261132629553682 and parameters: {'num_layers': 7, 'base_filters': 32, 'filter_growth': 'exponential', 'kernel_size': 13, 'dropout': 0.008251644912452775, 'reverse_dilation': True, 'batch_size': 8, 'learning_rate': 4.8546611809685425e-05, 'weight_decay': 0.002611830570150361, 'optimizer': 'Adam', 'use_augmentation': False, 'use_scheduler': False}. Best is trial 160 with value: 0.9658869395711501.

Trial 199 finished with F1 Score: 0.9261

================================================================================
OPTIMIZATION COMPLETE - REAL DATA
================================================================================

Number of finished trials: 200

--------------------------------------------------------------------------------
BEST TRIAL
--------------------------------------------------------------------------------
  Trial number: 160
  Macro F1 Score: 0.9659

  Best Hyperparameters:
    num_layers: 7
    base_filters: 32
    filter_growth: linear
    kernel_size: 13
    dropout: 0.02208528755253426
    reverse_dilation: True
    batch_size: 8
    learning_rate: 9.29558217542935e-05
    weight_decay: 0.0044478395955166086
    optimizer: AdamW
    use_augmentation: True
    use_scheduler: False

  Statistics:
    Complete trials: 91
    Pruned trials: 109

--------------------------------------------------------------------------------
TOP 10 TRIALS
--------------------------------------------------------------------------------
1. Trial 160: F1 = 0.9659
2. Trial 102: F1 = 0.9656
3. Trial 101: F1 = 0.9637
4. Trial 194: F1 = 0.9637
5. Trial 193: F1 = 0.9632
6. Trial 91: F1 = 0.9628
7. Trial 60: F1 = 0.9627
8. Trial 182: F1 = 0.9624
9. Trial 177: F1 = 0.9618
10. Trial 90: F1 = 0.9614

--------------------------------------------------------------------------------
HYPERPARAMETER IMPORTANCE
--------------------------------------------------------------------------------
  kernel_size: 0.4154
  optimizer: 0.3133
  learning_rate: 0.0674
  filter_growth: 0.0668
  num_layers: 0.0405
  dropout: 0.0296
  use_augmentation: 0.0191
  base_filters: 0.0157
  use_scheduler: 0.0094
  weight_decay: 0.0089
  reverse_dilation: 0.0085
  batch_size: 0.0053

================================================================================
RESULTS SAVED TO DATABASE
================================================================================
Database location: optuna_tcn_real_study.db
Study name: tcn_shark_real_data

To visualize results, use Optuna Dashboard:
  pip install optuna-dashboard
  optuna-dashboard sqlite:///optuna_tcn_real_study.db
================================================================================

Best hyperparameters also saved to: best_hyperparameters_real.json
Finished at: Tue 18 Nov 2025 09:10:53 PM EST
