[I 2025-11-18 02:23:26,069] Trial 71 finished with value: 1.0 and parameters: {'num_layers': 7, 'base_filters': 128, 'filter_growth': 'linear', 'kernel_size': 13, 'dropout': 0.2597195339888883, 'reverse_dilation': False, 'batch_size': 8, 'learning_rate': 2.333059315180563e-05, 'weight_decay': 2.560680006150079e-06, 'optimizer': 'AdamW', 'use_augmentation': False, 'use_scheduler': False}. Best is trial 11 with value: 1.0.

Trial 71 finished with F1 Score: 1.0000
[I 2025-11-18 02:34:08,604] Trial 72 finished with value: 1.0 and parameters: {'num_layers': 7, 'base_filters': 128, 'filter_growth': 'linear', 'kernel_size': 13, 'dropout': 0.2000790702423461, 'reverse_dilation': False, 'batch_size': 8, 'learning_rate': 3.5440766912578927e-05, 'weight_decay': 3.1592113786949488e-06, 'optimizer': 'AdamW', 'use_augmentation': False, 'use_scheduler': False}. Best is trial 11 with value: 1.0.

Trial 72 finished with F1 Score: 1.0000
[I 2025-11-18 02:47:23,059] Trial 73 finished with value: 1.0 and parameters: {'num_layers': 7, 'base_filters': 128, 'filter_growth': 'linear', 'kernel_size': 13, 'dropout': 0.2477936919909844, 'reverse_dilation': False, 'batch_size': 8, 'learning_rate': 2.008939465638169e-05, 'weight_decay': 6.673739257667799e-06, 'optimizer': 'AdamW', 'use_augmentation': False, 'use_scheduler': False}. Best is trial 11 with value: 1.0.

Trial 73 finished with F1 Score: 1.0000
[I 2025-11-18 02:51:49,565] Trial 74 pruned. 

Trial 74 finished with F1 Score: 0.7632
[I 2025-11-18 02:55:29,410] Trial 75 pruned. 

Trial 75 finished with F1 Score: 0.7711
[I 2025-11-18 02:56:15,682] Trial 76 pruned. 

Trial 76 finished with F1 Score: 0.0085
[I 2025-11-18 02:56:54,381] Trial 77 pruned. 

Trial 77 finished with F1 Score: 0.0886
[I 2025-11-18 02:57:20,950] Trial 78 pruned. 

Trial 78 finished with F1 Score: 0.1983
[I 2025-11-18 03:00:14,553] Trial 79 pruned. 

Trial 79 finished with F1 Score: 0.7771
[I 2025-11-18 03:10:43,064] Trial 80 finished with value: 0.9922027290448343 and parameters: {'num_layers': 7, 'base_filters': 128, 'filter_growth': 'linear', 'kernel_size': 11, 'dropout': 0.23024341763978812, 'reverse_dilation': False, 'batch_size': 8, 'learning_rate': 3.0611750350647334e-05, 'weight_decay': 4.458411863221023e-06, 'optimizer': 'AdamW', 'use_augmentation': False, 'use_scheduler': False}. Best is trial 11 with value: 1.0.

Trial 80 finished with F1 Score: 0.9922
[I 2025-11-18 03:14:48,944] Trial 81 pruned. 

Trial 81 finished with F1 Score: 0.8037
[I 2025-11-18 03:18:54,739] Trial 82 pruned. 

Trial 82 finished with F1 Score: 0.7424
[I 2025-11-18 03:32:09,608] Trial 83 finished with value: 1.0 and parameters: {'num_layers': 7, 'base_filters': 128, 'filter_growth': 'linear', 'kernel_size': 13, 'dropout': 0.2545081161815878, 'reverse_dilation': False, 'batch_size': 8, 'learning_rate': 2.1702261718522793e-05, 'weight_decay': 0.0008773957183807549, 'optimizer': 'AdamW', 'use_augmentation': False, 'use_scheduler': False}. Best is trial 11 with value: 1.0.

Trial 83 finished with F1 Score: 1.0000
[I 2025-11-18 03:36:15,088] Trial 84 pruned. 

Trial 84 finished with F1 Score: 0.7805
[I 2025-11-18 03:40:20,963] Trial 85 pruned. 

Trial 85 finished with F1 Score: 0.7388
[I 2025-11-18 03:47:15,675] Trial 86 pruned. 

Trial 86 finished with F1 Score: 0.7820
[I 2025-11-18 03:48:14,936] Trial 87 pruned. 

Trial 87 finished with F1 Score: 0.1864
[I 2025-11-18 03:58:56,594] Trial 88 finished with value: 1.0 and parameters: {'num_layers': 7, 'base_filters': 128, 'filter_growth': 'linear', 'kernel_size': 13, 'dropout': 0.2890919385818893, 'reverse_dilation': False, 'batch_size': 8, 'learning_rate': 3.334700452787006e-05, 'weight_decay': 0.00020080786380788026, 'optimizer': 'AdamW', 'use_augmentation': False, 'use_scheduler': False}. Best is trial 11 with value: 1.0.

Trial 88 finished with F1 Score: 1.0000
[I 2025-11-18 04:00:09,370] Trial 89 pruned. 

Trial 89 finished with F1 Score: 0.0010
[I 2025-11-18 04:00:35,659] Trial 90 pruned. 

Trial 90 finished with F1 Score: 0.2911
[I 2025-11-18 04:15:12,514] Trial 91 finished with value: 1.0 and parameters: {'num_layers': 7, 'base_filters': 128, 'filter_growth': 'linear', 'kernel_size': 13, 'dropout': 0.23774817332511178, 'reverse_dilation': False, 'batch_size': 8, 'learning_rate': 1.985956545743183e-05, 'weight_decay': 0.004067205141899652, 'optimizer': 'AdamW', 'use_augmentation': False, 'use_scheduler': False}. Best is trial 11 with value: 1.0.

Trial 91 finished with F1 Score: 1.0000
[I 2025-11-18 04:25:55,984] Trial 92 finished with value: 1.0 and parameters: {'num_layers': 7, 'base_filters': 128, 'filter_growth': 'linear', 'kernel_size': 13, 'dropout': 0.21254345028532498, 'reverse_dilation': False, 'batch_size': 8, 'learning_rate': 2.2986813789852935e-05, 'weight_decay': 0.0016754216632062075, 'optimizer': 'AdamW', 'use_augmentation': False, 'use_scheduler': False}. Best is trial 11 with value: 1.0.

Trial 92 finished with F1 Score: 1.0000
[I 2025-11-18 04:39:58,178] Trial 93 finished with value: 1.0 and parameters: {'num_layers': 7, 'base_filters': 128, 'filter_growth': 'linear', 'kernel_size': 13, 'dropout': 0.20233189100740723, 'reverse_dilation': False, 'batch_size': 8, 'learning_rate': 1.8152903675914157e-05, 'weight_decay': 0.009005522239936036, 'optimizer': 'AdamW', 'use_augmentation': False, 'use_scheduler': False}. Best is trial 11 with value: 1.0.

Trial 93 finished with F1 Score: 1.0000
[I 2025-11-18 04:53:57,104] Trial 94 finished with value: 1.0 and parameters: {'num_layers': 7, 'base_filters': 128, 'filter_growth': 'linear', 'kernel_size': 13, 'dropout': 0.17989607632495264, 'reverse_dilation': False, 'batch_size': 8, 'learning_rate': 7.537172344343495e-05, 'weight_decay': 0.0010038138817610703, 'optimizer': 'AdamW', 'use_augmentation': False, 'use_scheduler': False}. Best is trial 11 with value: 1.0.

Trial 94 finished with F1 Score: 1.0000
[I 2025-11-18 04:58:23,919] Trial 95 pruned. 

Trial 95 finished with F1 Score: 0.8727
[I 2025-11-18 04:58:51,065] Trial 96 pruned. 

Trial 96 finished with F1 Score: 0.1743
[I 2025-11-18 05:02:30,957] Trial 97 pruned. 

Trial 97 finished with F1 Score: 0.5698
[I 2025-11-18 05:12:26,706] Trial 98 finished with value: 1.0 and parameters: {'num_layers': 7, 'base_filters': 128, 'filter_growth': 'linear', 'kernel_size': 13, 'dropout': 0.22438996463315947, 'reverse_dilation': False, 'batch_size': 8, 'learning_rate': 3.741794196244374e-05, 'weight_decay': 0.0005819088499026392, 'optimizer': 'AdamW', 'use_augmentation': False, 'use_scheduler': True, 'scheduler_patience': 5, 'scheduler_factor': 0.555044426357229}. Best is trial 11 with value: 1.0.

Trial 98 finished with F1 Score: 1.0000
[I 2025-11-18 05:16:34,672] Trial 99 pruned. 

Trial 99 finished with F1 Score: 0.3502
[I 2025-11-18 05:18:02,558] Trial 100 pruned. 

Trial 100 finished with F1 Score: 0.6162
[I 2025-11-18 05:28:48,488] Trial 101 finished with value: 0.9922027290448343 and parameters: {'num_layers': 7, 'base_filters': 128, 'filter_growth': 'linear', 'kernel_size': 15, 'dropout': 0.2657812064995385, 'reverse_dilation': False, 'batch_size': 8, 'learning_rate': 4.0022315443097537e-05, 'weight_decay': 0.0004083186770382948, 'optimizer': 'AdamW', 'use_augmentation': False, 'use_scheduler': False}. Best is trial 11 with value: 1.0.

Trial 101 finished with F1 Score: 0.9922
[I 2025-11-18 05:43:11,721] Trial 102 finished with value: 1.0 and parameters: {'num_layers': 7, 'base_filters': 128, 'filter_growth': 'linear', 'kernel_size': 15, 'dropout': 0.15784655961405553, 'reverse_dilation': False, 'batch_size': 8, 'learning_rate': 1.846828725421577e-05, 'weight_decay': 0.0011955906463414563, 'optimizer': 'AdamW', 'use_augmentation': False, 'use_scheduler': False}. Best is trial 11 with value: 1.0.

Trial 102 finished with F1 Score: 1.0000
[I 2025-11-18 05:54:47,024] Trial 103 finished with value: 1.0 and parameters: {'num_layers': 7, 'base_filters': 128, 'filter_growth': 'linear', 'kernel_size': 15, 'dropout': 0.2508327250686219, 'reverse_dilation': False, 'batch_size': 8, 'learning_rate': 5.892979615400591e-05, 'weight_decay': 0.0002618917638061608, 'optimizer': 'AdamW', 'use_augmentation': False, 'use_scheduler': False}. Best is trial 11 with value: 1.0.

Trial 103 finished with F1 Score: 1.0000
[I 2025-11-18 06:05:28,701] Trial 104 finished with value: 1.0 and parameters: {'num_layers': 7, 'base_filters': 128, 'filter_growth': 'linear', 'kernel_size': 13, 'dropout': 0.2670558797222166, 'reverse_dilation': False, 'batch_size': 8, 'learning_rate': 3.382594031121686e-05, 'weight_decay': 0.0006599534481733105, 'optimizer': 'AdamW', 'use_augmentation': False, 'use_scheduler': False}. Best is trial 11 with value: 1.0.

Trial 104 finished with F1 Score: 1.0000
[I 2025-11-18 06:08:04,457] Trial 105 pruned. 

Trial 105 finished with F1 Score: 0.8316
[I 2025-11-18 06:19:29,074] Trial 106 finished with value: 0.9922027290448343 and parameters: {'num_layers': 7, 'base_filters': 128, 'filter_growth': 'linear', 'kernel_size': 15, 'dropout': 0.2806591237946822, 'reverse_dilation': False, 'batch_size': 8, 'learning_rate': 2.309339548595029e-05, 'weight_decay': 7.093337258241634e-05, 'optimizer': 'AdamW', 'use_augmentation': False, 'use_scheduler': False}. Best is trial 11 with value: 1.0.

Trial 106 finished with F1 Score: 0.9922
[I 2025-11-18 06:23:34,470] Trial 107 pruned. 

Trial 107 finished with F1 Score: 0.7817
[I 2025-11-18 06:24:47,685] Trial 108 pruned. 

Trial 108 finished with F1 Score: 0.0020
[I 2025-11-18 06:35:08,926] Trial 109 finished with value: 0.9925571504518873 and parameters: {'num_layers': 7, 'base_filters': 128, 'filter_growth': 'linear', 'kernel_size': 15, 'dropout': 0.31761571139970146, 'reverse_dilation': False, 'batch_size': 8, 'learning_rate': 4.598099548361999e-05, 'weight_decay': 0.0008112361194390173, 'optimizer': 'AdamW', 'use_augmentation': True, 'use_scheduler': False}. Best is trial 11 with value: 1.0.

Trial 109 finished with F1 Score: 0.9926
[I 2025-11-18 06:35:36,837] Trial 110 pruned. 

Trial 110 finished with F1 Score: 0.5696
[I 2025-11-18 06:39:41,982] Trial 111 pruned. 

Trial 111 finished with F1 Score: 0.8592
[I 2025-11-18 06:50:22,539] Trial 112 finished with value: 1.0 and parameters: {'num_layers': 7, 'base_filters': 128, 'filter_growth': 'linear', 'kernel_size': 13, 'dropout': 0.2952290022054552, 'reverse_dilation': False, 'batch_size': 8, 'learning_rate': 6.237837997519757e-05, 'weight_decay': 5.542610525778092e-05, 'optimizer': 'Adam', 'use_augmentation': False, 'use_scheduler': False}. Best is trial 11 with value: 1.0.

Trial 112 finished with F1 Score: 1.0000
[I 2025-11-18 06:54:27,965] Trial 113 pruned. 

Trial 113 finished with F1 Score: 0.7270
[I 2025-11-18 06:58:32,995] Trial 114 pruned. 

Trial 114 finished with F1 Score: 0.8542
[I 2025-11-18 06:59:05,389] Trial 115 pruned. 

Trial 115 finished with F1 Score: 0.1036
[I 2025-11-18 07:03:31,650] Trial 116 pruned. 

Trial 116 finished with F1 Score: 0.8645
[I 2025-11-18 07:07:13,105] Trial 117 pruned. 

Trial 117 finished with F1 Score: 0.8081
[I 2025-11-18 07:11:05,915] Trial 118 pruned. 

Trial 118 finished with F1 Score: 0.7525
[I 2025-11-18 07:13:47,757] Trial 119 pruned. 

Trial 119 finished with F1 Score: 0.2009
[I 2025-11-18 07:18:14,631] Trial 120 pruned. 

Trial 120 finished with F1 Score: 0.6865
[I 2025-11-18 07:28:10,552] Trial 121 finished with value: 1.0 and parameters: {'num_layers': 7, 'base_filters': 128, 'filter_growth': 'linear', 'kernel_size': 13, 'dropout': 0.26466641589605633, 'reverse_dilation': False, 'batch_size': 8, 'learning_rate': 2.5421957878493744e-05, 'weight_decay': 0.0002753480512740546, 'optimizer': 'AdamW', 'use_augmentation': False, 'use_scheduler': False}. Best is trial 11 with value: 1.0.

Trial 121 finished with F1 Score: 1.0000
[I 2025-11-18 07:32:16,191] Trial 122 pruned. 

Trial 122 finished with F1 Score: 0.8604
[I 2025-11-18 07:36:21,952] Trial 123 pruned. 

Trial 123 finished with F1 Score: 0.8091
[I 2025-11-18 07:46:18,561] Trial 124 finished with value: 1.0 and parameters: {'num_layers': 7, 'base_filters': 128, 'filter_growth': 'linear', 'kernel_size': 13, 'dropout': 0.23579843650349155, 'reverse_dilation': False, 'batch_size': 8, 'learning_rate': 2.5893000361505735e-05, 'weight_decay': 0.00023715465272709495, 'optimizer': 'AdamW', 'use_augmentation': False, 'use_scheduler': False}. Best is trial 11 with value: 1.0.

Trial 124 finished with F1 Score: 1.0000
[I 2025-11-18 07:48:54,364] Trial 125 pruned. 

Trial 125 finished with F1 Score: 0.8321
[I 2025-11-18 07:59:59,769] Trial 126 finished with value: 1.0 and parameters: {'num_layers': 7, 'base_filters': 128, 'filter_growth': 'linear', 'kernel_size': 13, 'dropout': 0.28468928936461163, 'reverse_dilation': False, 'batch_size': 8, 'learning_rate': 3.052444949458169e-05, 'weight_decay': 0.0004028592315165664, 'optimizer': 'AdamW', 'use_augmentation': False, 'use_scheduler': False}. Best is trial 11 with value: 1.0.

Trial 126 finished with F1 Score: 1.0000
[I 2025-11-18 08:00:22,665] Trial 127 pruned. 

Trial 127 finished with F1 Score: 0.0713
[I 2025-11-18 08:01:15,017] Trial 128 pruned. 

Trial 128 finished with F1 Score: 0.2483
[I 2025-11-18 08:05:16,561] Trial 129 pruned. 

Trial 129 finished with F1 Score: 0.0010
[I 2025-11-18 08:05:44,718] Trial 130 pruned. 

Trial 130 finished with F1 Score: 0.1114
[I 2025-11-18 08:18:12,296] Trial 131 finished with value: 1.0 and parameters: {'num_layers': 7, 'base_filters': 128, 'filter_growth': 'linear', 'kernel_size': 15, 'dropout': 0.19586859781685967, 'reverse_dilation': False, 'batch_size': 8, 'learning_rate': 5.147232658673612e-05, 'weight_decay': 0.0007219139761997709, 'optimizer': 'AdamW', 'use_augmentation': False, 'use_scheduler': False}. Best is trial 11 with value: 1.0.

Trial 131 finished with F1 Score: 1.0000
[I 2025-11-18 08:31:05,014] Trial 132 finished with value: 0.9961013645224172 and parameters: {'num_layers': 7, 'base_filters': 128, 'filter_growth': 'linear', 'kernel_size': 15, 'dropout': 0.2125010622865788, 'reverse_dilation': False, 'batch_size': 8, 'learning_rate': 3.78668159087531e-05, 'weight_decay': 0.0010486882178401228, 'optimizer': 'AdamW', 'use_augmentation': False, 'use_scheduler': False}. Best is trial 11 with value: 1.0.

Trial 132 finished with F1 Score: 0.9961
[I 2025-11-18 08:43:31,984] Trial 133 finished with value: 1.0 and parameters: {'num_layers': 7, 'base_filters': 128, 'filter_growth': 'linear', 'kernel_size': 15, 'dropout': 0.17901025516778224, 'reverse_dilation': False, 'batch_size': 8, 'learning_rate': 5.7416176962885745e-05, 'weight_decay': 0.0005758078448653031, 'optimizer': 'AdamW', 'use_augmentation': False, 'use_scheduler': False}. Best is trial 11 with value: 1.0.

Trial 133 finished with F1 Score: 1.0000
[I 2025-11-18 08:58:28,982] Trial 134 finished with value: 1.0 and parameters: {'num_layers': 7, 'base_filters': 128, 'filter_growth': 'linear', 'kernel_size': 15, 'dropout': 0.2042343304168396, 'reverse_dilation': False, 'batch_size': 8, 'learning_rate': 8.20234148267398e-05, 'weight_decay': 2.190329669512373e-06, 'optimizer': 'AdamW', 'use_augmentation': False, 'use_scheduler': False}. Best is trial 11 with value: 1.0.

Trial 134 finished with F1 Score: 1.0000
[I 2025-11-18 09:13:02,664] Trial 135 finished with value: 1.0 and parameters: {'num_layers': 7, 'base_filters': 128, 'filter_growth': 'linear', 'kernel_size': 13, 'dropout': 0.2681335156097076, 'reverse_dilation': False, 'batch_size': 8, 'learning_rate': 4.469416439667207e-05, 'weight_decay': 0.002030616945233178, 'optimizer': 'AdamW', 'use_augmentation': False, 'use_scheduler': False}. Best is trial 11 with value: 1.0.

Trial 135 finished with F1 Score: 1.0000
[I 2025-11-18 09:13:28,076] Trial 136 pruned. 

Trial 136 finished with F1 Score: 0.2014
[I 2025-11-18 09:17:37,625] Trial 137 pruned. 

Trial 137 finished with F1 Score: 0.6362
[I 2025-11-18 09:21:31,810] Trial 138 pruned. 

Trial 138 finished with F1 Score: 0.5174
[I 2025-11-18 09:25:57,121] Trial 139 pruned. 

Trial 139 finished with F1 Score: 0.4566
[I 2025-11-18 09:35:51,588] Trial 140 finished with value: 1.0 and parameters: {'num_layers': 7, 'base_filters': 128, 'filter_growth': 'linear', 'kernel_size': 13, 'dropout': 0.295105455898241, 'reverse_dilation': False, 'batch_size': 8, 'learning_rate': 5.125984469856085e-05, 'weight_decay': 0.0004572195295687347, 'optimizer': 'AdamW', 'use_augmentation': False, 'use_scheduler': False}. Best is trial 11 with value: 1.0.

Trial 140 finished with F1 Score: 1.0000
[I 2025-11-18 09:46:57,575] Trial 141 finished with value: 1.0 and parameters: {'num_layers': 7, 'base_filters': 128, 'filter_growth': 'linear', 'kernel_size': 13, 'dropout': 0.25966664088939095, 'reverse_dilation': False, 'batch_size': 8, 'learning_rate': 2.4098605576005844e-05, 'weight_decay': 2.2660448509199323e-06, 'optimizer': 'AdamW', 'use_augmentation': False, 'use_scheduler': False}. Best is trial 11 with value: 1.0.

Trial 141 finished with F1 Score: 1.0000
[I 2025-11-18 09:52:36,664] Trial 142 pruned. 

Trial 142 finished with F1 Score: 0.9360
[I 2025-11-18 09:56:42,386] Trial 143 pruned. 

Trial 143 finished with F1 Score: 0.8037
[I 2025-11-18 10:07:24,719] Trial 144 finished with value: 1.0 and parameters: {'num_layers': 7, 'base_filters': 128, 'filter_growth': 'linear', 'kernel_size': 13, 'dropout': 0.2620660985676734, 'reverse_dilation': False, 'batch_size': 8, 'learning_rate': 2.9013053063461226e-05, 'weight_decay': 3.844470534051777e-06, 'optimizer': 'AdamW', 'use_augmentation': False, 'use_scheduler': False}. Best is trial 11 with value: 1.0.

Trial 144 finished with F1 Score: 1.0000
[I 2025-11-18 10:11:30,313] Trial 145 pruned. 

Trial 145 finished with F1 Score: 0.9032
[I 2025-11-18 10:18:29,725] Trial 146 pruned. 

Trial 146 finished with F1 Score: 0.9166
[I 2025-11-18 10:21:42,410] Trial 147 pruned. 

Trial 147 finished with F1 Score: 0.8549
[I 2025-11-18 10:24:18,353] Trial 148 pruned. 

Trial 148 finished with F1 Score: 0.8321
[I 2025-11-18 10:28:23,882] Trial 149 pruned. 

Trial 149 finished with F1 Score: 0.8290
[I 2025-11-18 10:29:19,582] Trial 150 pruned. 

Trial 150 finished with F1 Score: 0.0460
[I 2025-11-18 10:39:50,241] Trial 151 finished with value: 1.0 and parameters: {'num_layers': 7, 'base_filters': 128, 'filter_growth': 'linear', 'kernel_size': 13, 'dropout': 0.1967915837857089, 'reverse_dilation': False, 'batch_size': 8, 'learning_rate': 3.6593946991146206e-05, 'weight_decay': 4.583157229865603e-06, 'optimizer': 'AdamW', 'use_augmentation': False, 'use_scheduler': False}. Best is trial 11 with value: 1.0.

Trial 151 finished with F1 Score: 1.0000
[I 2025-11-18 10:50:57,199] Trial 152 finished with value: 1.0 and parameters: {'num_layers': 7, 'base_filters': 128, 'filter_growth': 'linear', 'kernel_size': 13, 'dropout': 0.182621189798475, 'reverse_dilation': False, 'batch_size': 8, 'learning_rate': 2.0342090281990362e-05, 'weight_decay': 2.4697669018593164e-06, 'optimizer': 'AdamW', 'use_augmentation': False, 'use_scheduler': False}. Best is trial 11 with value: 1.0.

Trial 152 finished with F1 Score: 1.0000
[I 2025-11-18 11:02:03,054] Trial 153 finished with value: 0.9961013645224172 and parameters: {'num_layers': 7, 'base_filters': 128, 'filter_growth': 'linear', 'kernel_size': 13, 'dropout': 0.2827944705533531, 'reverse_dilation': False, 'batch_size': 8, 'learning_rate': 2.7119753405875758e-05, 'weight_decay': 2.861087582746319e-06, 'optimizer': 'AdamW', 'use_augmentation': False, 'use_scheduler': False}. Best is trial 11 with value: 1.0.

Trial 153 finished with F1 Score: 0.9961
[I 2025-11-18 11:11:34,842] Trial 154 finished with value: 1.0 and parameters: {'num_layers': 7, 'base_filters': 128, 'filter_growth': 'linear', 'kernel_size': 13, 'dropout': 0.19102030926524188, 'reverse_dilation': False, 'batch_size': 8, 'learning_rate': 6.522370940952384e-05, 'weight_decay': 1.5560914510524943e-06, 'optimizer': 'AdamW', 'use_augmentation': False, 'use_scheduler': False}. Best is trial 11 with value: 1.0.

Trial 154 finished with F1 Score: 1.0000
[I 2025-11-18 11:12:48,691] Trial 155 pruned. 

Trial 155 finished with F1 Score: 0.8237
[I 2025-11-18 11:16:54,863] Trial 156 pruned. 

Trial 156 finished with F1 Score: 0.7678
[I 2025-11-18 11:17:23,045] Trial 157 pruned. 

Trial 157 finished with F1 Score: 0.2631
[I 2025-11-18 11:21:03,201] Trial 158 pruned. 

Trial 158 finished with F1 Score: 0.8594
[I 2025-11-18 11:21:24,782] Trial 159 pruned. 

Trial 159 finished with F1 Score: 0.8295
[I 2025-11-18 11:32:24,504] Trial 160 finished with value: 0.9922027290448343 and parameters: {'num_layers': 7, 'base_filters': 128, 'filter_growth': 'linear', 'kernel_size': 15, 'dropout': 0.2041789331766294, 'reverse_dilation': False, 'batch_size': 8, 'learning_rate': 2.384401467378615e-05, 'weight_decay': 7.480834712568806e-05, 'optimizer': 'AdamW', 'use_augmentation': False, 'use_scheduler': False}. Best is trial 11 with value: 1.0.

Trial 160 finished with F1 Score: 0.9922
[I 2025-11-18 11:36:30,007] Trial 161 pruned. 

Trial 161 finished with F1 Score: 0.8799
[I 2025-11-18 11:40:35,488] Trial 162 pruned. 

Trial 162 finished with F1 Score: 0.8152
[I 2025-11-18 11:53:49,682] Trial 163 finished with value: 1.0 and parameters: {'num_layers': 7, 'base_filters': 128, 'filter_growth': 'linear', 'kernel_size': 13, 'dropout': 0.2445474833253293, 'reverse_dilation': False, 'batch_size': 8, 'learning_rate': 2.7981255555182134e-05, 'weight_decay': 6.830590474480976e-06, 'optimizer': 'AdamW', 'use_augmentation': False, 'use_scheduler': False}. Best is trial 11 with value: 1.0.

Trial 163 finished with F1 Score: 1.0000
[I 2025-11-18 11:57:55,223] Trial 164 pruned. 

Trial 164 finished with F1 Score: 0.8091
