Job started at: Mon 17 Nov 2025 06:43:43 PM EST
Running on node: gpu-5-22
Python location: /home/bzzeng/shark/.venv/bin/python
CUDA available: True
================================================================================
DEVICE INFORMATION
================================================================================
Using device: cuda
GPU Name: NVIDIA L40S
GPU Count: 1
CUDA Version: 12.1
Current GPU: 0
GPU Memory: 44.42 GB
================================================================================

LOADING AND PREPROCESSING DATA
Dataset shape: (891, 3476)
Number of classes: 57
Training pool size: 712
Test set size: 179

================================================================================
STARTING OPTUNA HYPERPARAMETER OPTIMIZATION
================================================================================
Target: Maximize Macro F1 Score
Number of trials: 200
Database: optuna_tcn_study.db
================================================================================

Study created/loaded: tcn_shark_classification
Storage: sqlite:///optuna_tcn_study.db
Optimization direction: maximize

[I 2025-11-17 18:44:35,648] Trial 0 finished with value: 0.28630842841369153 and parameters: {'num_layers': 4, 'base_filters': 32, 'filter_growth': 'constant', 'kernel_size': 7, 'dropout': 0.040705370779918426, 'reverse_dilation': False, 'batch_size': 8, 'learning_rate': 0.0003346543894512671, 'weight_decay': 1.1934877091628979e-06, 'optimizer': 'AdamW', 'use_augmentation': False, 'use_scheduler': True, 'scheduler_patience': 11, 'scheduler_factor': 0.13978846850334278}. Best is trial 0 with value: 0.28630842841369153.

Trial 0 finished with F1 Score: 0.2863
[I 2025-11-17 18:44:57,048] Trial 1 finished with value: 0.00583288117200217 and parameters: {'num_layers': 4, 'base_filters': 32, 'filter_growth': 'exponential', 'kernel_size': 9, 'dropout': 0.4776987432443814, 'reverse_dilation': True, 'batch_size': 16, 'learning_rate': 3.079030324673957e-05, 'weight_decay': 0.0001465621366410536, 'optimizer': 'SGD', 'use_augmentation': True, 'use_scheduler': True, 'scheduler_patience': 12, 'scheduler_factor': 0.4837311505893691}. Best is trial 0 with value: 0.28630842841369153.

Trial 1 finished with F1 Score: 0.0058
[I 2025-11-17 18:45:37,585] Trial 2 finished with value: 0.7982734614313561 and parameters: {'num_layers': 3, 'base_filters': 128, 'filter_growth': 'constant', 'kernel_size': 13, 'dropout': 0.1384777639055625, 'reverse_dilation': True, 'batch_size': 16, 'learning_rate': 0.0006191923478717325, 'weight_decay': 1.8569709138973066e-05, 'optimizer': 'Adam', 'use_augmentation': False, 'use_scheduler': True, 'scheduler_patience': 15, 'scheduler_factor': 0.18869553911460757}. Best is trial 2 with value: 0.7982734614313561.

Trial 2 finished with F1 Score: 0.7983
[I 2025-11-17 18:45:56,880] Trial 3 finished with value: 0.05780106832738411 and parameters: {'num_layers': 3, 'base_filters': 64, 'filter_growth': 'constant', 'kernel_size': 9, 'dropout': 0.29797770227697545, 'reverse_dilation': False, 'batch_size': 64, 'learning_rate': 0.00027546484928994117, 'weight_decay': 5.154098536042098e-06, 'optimizer': 'SGD', 'use_augmentation': False, 'use_scheduler': True, 'scheduler_patience': 12, 'scheduler_factor': 0.5494718793624579}. Best is trial 2 with value: 0.7982734614313561.

Trial 3 finished with F1 Score: 0.0578
[I 2025-11-17 18:48:03,440] Trial 4 finished with value: 0.9688109161793373 and parameters: {'num_layers': 7, 'base_filters': 32, 'filter_growth': 'linear', 'kernel_size': 11, 'dropout': 0.14648070918982264, 'reverse_dilation': True, 'batch_size': 8, 'learning_rate': 4.8170664567625175e-05, 'weight_decay': 7.269006563433483e-06, 'optimizer': 'Adam', 'use_augmentation': True, 'use_scheduler': False}. Best is trial 4 with value: 0.9688109161793373.

Trial 4 finished with F1 Score: 0.9688
[I 2025-11-17 18:51:35,580] Trial 5 finished with value: 0.9116604642920432 and parameters: {'num_layers': 5, 'base_filters': 32, 'filter_growth': 'exponential', 'kernel_size': 13, 'dropout': 0.0964458196064511, 'reverse_dilation': False, 'batch_size': 32, 'learning_rate': 0.005338680111076478, 'weight_decay': 0.00046548149506866023, 'optimizer': 'SGD', 'use_augmentation': True, 'use_scheduler': False}. Best is trial 4 with value: 0.9688109161793373.

Trial 5 finished with F1 Score: 0.9117
[I 2025-11-17 19:01:39,048] Trial 6 finished with value: 0.8367446393762183 and parameters: {'num_layers': 6, 'base_filters': 128, 'filter_growth': 'linear', 'kernel_size': 9, 'dropout': 0.4269790039763277, 'reverse_dilation': True, 'batch_size': 16, 'learning_rate': 0.0031961849270958917, 'weight_decay': 1.7222869999502653e-06, 'optimizer': 'Adam', 'use_augmentation': True, 'use_scheduler': False}. Best is trial 4 with value: 0.9688109161793373.

Trial 6 finished with F1 Score: 0.8367
[I 2025-11-17 19:06:11,789] Trial 7 finished with value: 0.47221209589630636 and parameters: {'num_layers': 5, 'base_filters': 128, 'filter_growth': 'linear', 'kernel_size': 5, 'dropout': 0.46696821914775116, 'reverse_dilation': False, 'batch_size': 64, 'learning_rate': 0.0006091946865308775, 'weight_decay': 0.0008052883580265886, 'optimizer': 'Adam', 'use_augmentation': True, 'use_scheduler': True, 'scheduler_patience': 5, 'scheduler_factor': 0.6440935987993456}. Best is trial 4 with value: 0.9688109161793373.

Trial 7 finished with F1 Score: 0.4722
[I 2025-11-17 19:06:18,317] Trial 8 finished with value: 0.0596845516236098 and parameters: {'num_layers': 4, 'base_filters': 32, 'filter_growth': 'constant', 'kernel_size': 5, 'dropout': 0.45847910463013797, 'reverse_dilation': True, 'batch_size': 32, 'learning_rate': 0.0031859721758559713, 'weight_decay': 2.2709531083797303e-05, 'optimizer': 'SGD', 'use_augmentation': False, 'use_scheduler': False}. Best is trial 4 with value: 0.9688109161793373.

Trial 8 finished with F1 Score: 0.0597
[I 2025-11-17 19:07:38,754] Trial 9 finished with value: 0.956849193691299 and parameters: {'num_layers': 6, 'base_filters': 128, 'filter_growth': 'constant', 'kernel_size': 11, 'dropout': 0.12697691580213255, 'reverse_dilation': False, 'batch_size': 8, 'learning_rate': 0.0001307142089636043, 'weight_decay': 6.417200172211686e-06, 'optimizer': 'AdamW', 'use_augmentation': False, 'use_scheduler': True, 'scheduler_patience': 9, 'scheduler_factor': 0.17271721873911586}. Best is trial 4 with value: 0.9688109161793373.

Trial 9 finished with F1 Score: 0.9568
[I 2025-11-17 19:10:00,772] Trial 10 pruned. 

Trial 10 finished with F1 Score: 0.4689
[I 2025-11-17 19:19:55,082] Trial 11 finished with value: 1.0 and parameters: {'num_layers': 7, 'base_filters': 128, 'filter_growth': 'linear', 'kernel_size': 13, 'dropout': 0.1991194578395904, 'reverse_dilation': False, 'batch_size': 8, 'learning_rate': 5.30273463951994e-05, 'weight_decay': 1.5396967697445294e-05, 'optimizer': 'AdamW', 'use_augmentation': False, 'use_scheduler': False}. Best is trial 11 with value: 1.0.

Trial 11 finished with F1 Score: 1.0000
[I 2025-11-17 19:39:58,038] Trial 12 finished with value: 0.9736842105263158 and parameters: {'num_layers': 7, 'base_filters': 128, 'filter_growth': 'linear', 'kernel_size': 15, 'dropout': 0.23352421454971112, 'reverse_dilation': True, 'batch_size': 8, 'learning_rate': 6.223069691057942e-05, 'weight_decay': 2.9557918342781555e-05, 'optimizer': 'AdamW', 'use_augmentation': False, 'use_scheduler': False}. Best is trial 11 with value: 1.0.

Trial 12 finished with F1 Score: 0.9737
[I 2025-11-17 19:51:32,547] Trial 13 finished with value: 1.0 and parameters: {'num_layers': 7, 'base_filters': 128, 'filter_growth': 'linear', 'kernel_size': 15, 'dropout': 0.26147219520570436, 'reverse_dilation': False, 'batch_size': 8, 'learning_rate': 6.415011510014917e-05, 'weight_decay': 6.879931586027079e-05, 'optimizer': 'AdamW', 'use_augmentation': False, 'use_scheduler': False}. Best is trial 11 with value: 1.0.

Trial 13 finished with F1 Score: 1.0000
[I 2025-11-17 19:54:18,019] Trial 14 pruned. 

Trial 14 finished with F1 Score: 0.3102
[I 2025-11-17 20:15:12,316] Trial 15 finished with value: 0.9883040935672515 and parameters: {'num_layers': 7, 'base_filters': 128, 'filter_growth': 'linear', 'kernel_size': 15, 'dropout': 0.3714770792992847, 'reverse_dilation': False, 'batch_size': 8, 'learning_rate': 0.00011188811290714138, 'weight_decay': 0.0004187638174870037, 'optimizer': 'AdamW', 'use_augmentation': False, 'use_scheduler': False}. Best is trial 11 with value: 1.0.

Trial 15 finished with F1 Score: 0.9883
[I 2025-11-17 20:22:18,236] Trial 16 finished with value: 0.9730639730639731 and parameters: {'num_layers': 6, 'base_filters': 64, 'filter_growth': 'exponential', 'kernel_size': 11, 'dropout': 0.19813051113962266, 'reverse_dilation': False, 'batch_size': 8, 'learning_rate': 2.5094756595354043e-05, 'weight_decay': 4.519983377347267e-05, 'optimizer': 'AdamW', 'use_augmentation': False, 'use_scheduler': False}. Best is trial 11 with value: 1.0.

Trial 16 finished with F1 Score: 0.9731
[I 2025-11-17 20:23:26,807] Trial 17 pruned. 

Trial 17 finished with F1 Score: 0.1110
[I 2025-11-17 20:32:47,879] Trial 18 finished with value: 0.9691653375863903 and parameters: {'num_layers': 7, 'base_filters': 128, 'filter_growth': 'linear', 'kernel_size': 13, 'dropout': 0.0009451369229923623, 'reverse_dilation': False, 'batch_size': 64, 'learning_rate': 2.2861084981434e-05, 'weight_decay': 0.00016997367367587197, 'optimizer': 'AdamW', 'use_augmentation': False, 'use_scheduler': False}. Best is trial 11 with value: 1.0.

Trial 18 finished with F1 Score: 0.9692
[I 2025-11-17 20:41:45,453] Trial 19 finished with value: 0.9922027290448343 and parameters: {'num_layers': 6, 'base_filters': 128, 'filter_growth': 'linear', 'kernel_size': 15, 'dropout': 0.18532409542494946, 'reverse_dilation': False, 'batch_size': 8, 'learning_rate': 6.42038736000613e-05, 'weight_decay': 5.7825463379445135e-05, 'optimizer': 'AdamW', 'use_augmentation': False, 'use_scheduler': False}. Best is trial 11 with value: 1.0.

Trial 19 finished with F1 Score: 0.9922
[I 2025-11-17 20:47:21,617] Trial 20 finished with value: 0.9465178096757044 and parameters: {'num_layers': 7, 'base_filters': 64, 'filter_growth': 'exponential', 'kernel_size': 11, 'dropout': 0.36190305033145825, 'reverse_dilation': False, 'batch_size': 8, 'learning_rate': 0.00022456187568267825, 'weight_decay': 2.7079270418360364e-06, 'optimizer': 'AdamW', 'use_augmentation': False, 'use_scheduler': False}. Best is trial 11 with value: 1.0.

Trial 20 finished with F1 Score: 0.9465
[I 2025-11-17 20:55:46,964] Trial 21 finished with value: 0.9922027290448343 and parameters: {'num_layers': 6, 'base_filters': 128, 'filter_growth': 'linear', 'kernel_size': 15, 'dropout': 0.18700669580703408, 'reverse_dilation': False, 'batch_size': 8, 'learning_rate': 6.981853931231333e-05, 'weight_decay': 6.054883951746608e-05, 'optimizer': 'AdamW', 'use_augmentation': False, 'use_scheduler': False}. Best is trial 11 with value: 1.0.

Trial 21 finished with F1 Score: 0.9922
[I 2025-11-17 21:04:12,735] Trial 22 finished with value: 0.9922027290448343 and parameters: {'num_layers': 6, 'base_filters': 128, 'filter_growth': 'linear', 'kernel_size': 15, 'dropout': 0.19348924145258134, 'reverse_dilation': False, 'batch_size': 8, 'learning_rate': 4.256930425885586e-05, 'weight_decay': 1.3671890910753374e-05, 'optimizer': 'AdamW', 'use_augmentation': False, 'use_scheduler': False}. Best is trial 11 with value: 1.0.

Trial 22 finished with F1 Score: 0.9922
[I 2025-11-17 21:18:48,102] Trial 23 finished with value: 1.0 and parameters: {'num_layers': 7, 'base_filters': 128, 'filter_growth': 'linear', 'kernel_size': 13, 'dropout': 0.27023057661735217, 'reverse_dilation': False, 'batch_size': 8, 'learning_rate': 1.8091698186646166e-05, 'weight_decay': 5.5405808216190014e-05, 'optimizer': 'AdamW', 'use_augmentation': False, 'use_scheduler': False}. Best is trial 11 with value: 1.0.

Trial 23 finished with F1 Score: 1.0000
[I 2025-11-17 21:35:09,036] Trial 24 finished with value: 1.0 and parameters: {'num_layers': 7, 'base_filters': 128, 'filter_growth': 'linear', 'kernel_size': 13, 'dropout': 0.2561029840455312, 'reverse_dilation': False, 'batch_size': 8, 'learning_rate': 1.4838173807114498e-05, 'weight_decay': 0.0002912491010454841, 'optimizer': 'AdamW', 'use_augmentation': False, 'use_scheduler': False}. Best is trial 11 with value: 1.0.

Trial 24 finished with F1 Score: 1.0000
[I 2025-11-17 21:49:43,645] Trial 25 finished with value: 1.0 and parameters: {'num_layers': 7, 'base_filters': 128, 'filter_growth': 'linear', 'kernel_size': 13, 'dropout': 0.3430831911010622, 'reverse_dilation': False, 'batch_size': 8, 'learning_rate': 1.9165767424675823e-05, 'weight_decay': 1.27604317000492e-05, 'optimizer': 'AdamW', 'use_augmentation': False, 'use_scheduler': False}. Best is trial 11 with value: 1.0.

Trial 25 finished with F1 Score: 1.0000
[I 2025-11-17 22:06:05,853] Trial 26 finished with value: 0.9883040935672515 and parameters: {'num_layers': 7, 'base_filters': 128, 'filter_growth': 'linear', 'kernel_size': 11, 'dropout': 0.2584341370863284, 'reverse_dilation': False, 'batch_size': 16, 'learning_rate': 3.418971870121649e-05, 'weight_decay': 4.007391360581165e-05, 'optimizer': 'AdamW', 'use_augmentation': False, 'use_scheduler': False}. Best is trial 11 with value: 1.0.

Trial 26 finished with F1 Score: 0.9883
[I 2025-11-17 22:08:46,696] Trial 27 pruned. 

Trial 27 finished with F1 Score: 0.5986
[I 2025-11-17 22:10:52,329] Trial 28 pruned. 

Trial 28 finished with F1 Score: 0.3811
[I 2025-11-17 22:11:11,789] Trial 29 pruned. 

Trial 29 finished with F1 Score: 0.0394
[I 2025-11-17 22:11:18,901] Trial 30 pruned. 

Trial 30 finished with F1 Score: 0.1202
[I 2025-11-17 22:26:06,714] Trial 31 finished with value: 1.0 and parameters: {'num_layers': 7, 'base_filters': 128, 'filter_growth': 'linear', 'kernel_size': 13, 'dropout': 0.26111292609496994, 'reverse_dilation': False, 'batch_size': 8, 'learning_rate': 1.8173806780610855e-05, 'weight_decay': 0.0003482811158803348, 'optimizer': 'AdamW', 'use_augmentation': False, 'use_scheduler': False}. Best is trial 11 with value: 1.0.

Trial 31 finished with F1 Score: 1.0000
[I 2025-11-17 22:30:11,889] Trial 32 pruned. 

Trial 32 finished with F1 Score: 0.7323
[I 2025-11-17 22:43:36,399] Trial 33 finished with value: 1.0 and parameters: {'num_layers': 7, 'base_filters': 128, 'filter_growth': 'linear', 'kernel_size': 13, 'dropout': 0.2676410579260293, 'reverse_dilation': False, 'batch_size': 8, 'learning_rate': 3.342432951653532e-05, 'weight_decay': 0.0002782766356324152, 'optimizer': 'AdamW', 'use_augmentation': False, 'use_scheduler': False}. Best is trial 11 with value: 1.0.

Trial 33 finished with F1 Score: 1.0000
[I 2025-11-17 22:46:54,801] Trial 34 pruned. 

Trial 34 finished with F1 Score: 0.5826
[I 2025-11-17 22:49:44,142] Trial 35 pruned. 

Trial 35 finished with F1 Score: 0.0132
[I 2025-11-17 22:49:49,811] Trial 36 pruned. 

Trial 36 finished with F1 Score: 0.0387
[I 2025-11-17 22:52:32,406] Trial 37 pruned. 

Trial 37 finished with F1 Score: 0.2569
[I 2025-11-17 22:54:50,319] Trial 38 pruned. 

Trial 38 finished with F1 Score: 0.0010
[I 2025-11-17 22:55:25,870] Trial 39 pruned. 

Trial 39 finished with F1 Score: 0.1993
[I 2025-11-17 22:55:41,330] Trial 40 pruned. 

Trial 40 finished with F1 Score: 0.0800
[I 2025-11-17 22:59:46,900] Trial 41 pruned. 

Trial 41 finished with F1 Score: 0.7200
[I 2025-11-17 23:14:34,185] Trial 42 finished with value: 1.0 and parameters: {'num_layers': 7, 'base_filters': 128, 'filter_growth': 'linear', 'kernel_size': 13, 'dropout': 0.257434960595879, 'reverse_dilation': False, 'batch_size': 8, 'learning_rate': 2.271385478167012e-05, 'weight_decay': 3.826804889320378e-06, 'optimizer': 'AdamW', 'use_augmentation': False, 'use_scheduler': False}. Best is trial 11 with value: 1.0.

Trial 42 finished with F1 Score: 1.0000
[I 2025-11-17 23:18:38,036] Trial 43 pruned. 

Trial 43 finished with F1 Score: 0.5435
[I 2025-11-17 23:30:16,736] Trial 44 finished with value: 0.9922027290448343 and parameters: {'num_layers': 7, 'base_filters': 128, 'filter_growth': 'linear', 'kernel_size': 11, 'dropout': 0.33546723981590304, 'reverse_dilation': False, 'batch_size': 8, 'learning_rate': 3.310102510837701e-05, 'weight_decay': 1.4256913112221477e-05, 'optimizer': 'AdamW', 'use_augmentation': False, 'use_scheduler': False}. Best is trial 11 with value: 1.0.

Trial 44 finished with F1 Score: 0.9922
[I 2025-11-17 23:34:05,110] Trial 45 pruned. 

Trial 45 finished with F1 Score: 0.3186
[I 2025-11-17 23:36:56,557] Trial 46 pruned. 

Trial 46 finished with F1 Score: 0.4120
[I 2025-11-17 23:37:11,094] Trial 47 pruned. 

Trial 47 finished with F1 Score: 0.0118
[I 2025-11-17 23:40:45,089] Trial 48 pruned. 

Trial 48 finished with F1 Score: 0.7442
[I 2025-11-17 23:41:04,197] Trial 49 pruned. 

Trial 49 finished with F1 Score: 0.0524
[I 2025-11-17 23:42:03,483] Trial 50 pruned. 

Trial 50 finished with F1 Score: 0.0293
[I 2025-11-17 23:56:38,357] Trial 51 finished with value: 1.0 and parameters: {'num_layers': 7, 'base_filters': 128, 'filter_growth': 'linear', 'kernel_size': 13, 'dropout': 0.26225296841306817, 'reverse_dilation': False, 'batch_size': 8, 'learning_rate': 1.7442018394743763e-05, 'weight_decay': 0.00032386106129875014, 'optimizer': 'AdamW', 'use_augmentation': False, 'use_scheduler': False}. Best is trial 11 with value: 1.0.

Trial 51 finished with F1 Score: 1.0000
[I 2025-11-18 00:10:28,422] Trial 52 finished with value: 1.0 and parameters: {'num_layers': 7, 'base_filters': 128, 'filter_growth': 'linear', 'kernel_size': 13, 'dropout': 0.21338421512601008, 'reverse_dilation': False, 'batch_size': 8, 'learning_rate': 1.8429928324222143e-05, 'weight_decay': 0.00129407211384372, 'optimizer': 'AdamW', 'use_augmentation': False, 'use_scheduler': False}. Best is trial 11 with value: 1.0.

Trial 52 finished with F1 Score: 1.0000
[I 2025-11-18 00:14:33,716] Trial 53 pruned. 

Trial 53 finished with F1 Score: 0.5805
[I 2025-11-18 00:26:35,360] Trial 54 finished with value: 1.0 and parameters: {'num_layers': 7, 'base_filters': 128, 'filter_growth': 'linear', 'kernel_size': 15, 'dropout': 0.2703414768852156, 'reverse_dilation': False, 'batch_size': 8, 'learning_rate': 3.6672971396408384e-05, 'weight_decay': 0.00042130484785160777, 'optimizer': 'AdamW', 'use_augmentation': False, 'use_scheduler': False}. Best is trial 11 with value: 1.0.

Trial 54 finished with F1 Score: 1.0000
[I 2025-11-18 00:28:56,136] Trial 55 pruned. 

Trial 55 finished with F1 Score: 0.7284
[I 2025-11-18 00:48:05,655] Trial 56 finished with value: 1.0 and parameters: {'num_layers': 7, 'base_filters': 128, 'filter_growth': 'linear', 'kernel_size': 13, 'dropout': 0.4366641313847915, 'reverse_dilation': False, 'batch_size': 8, 'learning_rate': 5.3645746037570187e-05, 'weight_decay': 5.1303676889834466e-05, 'optimizer': 'Adam', 'use_augmentation': False, 'use_scheduler': False}. Best is trial 11 with value: 1.0.

Trial 56 finished with F1 Score: 1.0000
[I 2025-11-18 00:52:45,200] Trial 57 pruned. 

Trial 57 finished with F1 Score: 0.7789
[I 2025-11-18 00:54:09,774] Trial 58 pruned. 

Trial 58 finished with F1 Score: 0.4733
[I 2025-11-18 00:57:27,217] Trial 59 pruned. 

Trial 59 finished with F1 Score: 0.1228
[I 2025-11-18 00:57:40,736] Trial 60 pruned. 

Trial 60 finished with F1 Score: 0.0013
[I 2025-11-18 01:11:07,062] Trial 61 finished with value: 1.0 and parameters: {'num_layers': 7, 'base_filters': 128, 'filter_growth': 'linear', 'kernel_size': 13, 'dropout': 0.2843522592418494, 'reverse_dilation': False, 'batch_size': 8, 'learning_rate': 2.6049921968341557e-05, 'weight_decay': 0.00023136144157814674, 'optimizer': 'AdamW', 'use_augmentation': False, 'use_scheduler': False}. Best is trial 11 with value: 1.0.

Trial 61 finished with F1 Score: 1.0000
[I 2025-11-18 01:22:05,873] Trial 62 finished with value: 0.9922027290448343 and parameters: {'num_layers': 7, 'base_filters': 128, 'filter_growth': 'linear', 'kernel_size': 11, 'dropout': 0.27261937644748313, 'reverse_dilation': False, 'batch_size': 8, 'learning_rate': 3.816776571903159e-05, 'weight_decay': 0.00032708012359751904, 'optimizer': 'AdamW', 'use_augmentation': False, 'use_scheduler': False}. Best is trial 11 with value: 1.0.

Trial 62 finished with F1 Score: 0.9922
[I 2025-11-18 01:33:12,338] Trial 63 finished with value: 0.9961013645224172 and parameters: {'num_layers': 7, 'base_filters': 128, 'filter_growth': 'linear', 'kernel_size': 13, 'dropout': 0.2510144925153861, 'reverse_dilation': False, 'batch_size': 8, 'learning_rate': 2.2196854472782385e-05, 'weight_decay': 6.422613678341225e-05, 'optimizer': 'AdamW', 'use_augmentation': False, 'use_scheduler': False}. Best is trial 11 with value: 1.0.

Trial 63 finished with F1 Score: 0.9961
[I 2025-11-18 01:45:39,244] Trial 64 finished with value: 1.0 and parameters: {'num_layers': 7, 'base_filters': 128, 'filter_growth': 'linear', 'kernel_size': 15, 'dropout': 0.20647457455783974, 'reverse_dilation': False, 'batch_size': 8, 'learning_rate': 5.249470144817416e-05, 'weight_decay': 0.0010506298208626862, 'optimizer': 'AdamW', 'use_augmentation': False, 'use_scheduler': False}. Best is trial 11 with value: 1.0.

Trial 64 finished with F1 Score: 1.0000
[I 2025-11-18 01:49:44,469] Trial 65 pruned. 

Trial 65 finished with F1 Score: 0.7332
[I 2025-11-18 01:49:56,181] Trial 66 pruned. 

Trial 66 finished with F1 Score: 0.0592
[I 2025-11-18 01:56:38,704] Trial 67 pruned. 

Trial 67 finished with F1 Score: 0.9442
[I 2025-11-18 02:00:45,369] Trial 68 pruned. 

Trial 68 finished with F1 Score: 0.7905
[I 2025-11-18 02:08:05,372] Trial 69 pruned. 

Trial 69 finished with F1 Score: 0.9637
[I 2025-11-18 02:09:35,740] Trial 70 pruned. 

Trial 70 finished with F1 Score: 0.4840
