[I 2025-11-18 12:08:37,506] Trial 165 finished with value: 1.0 and parameters: {'num_layers': 7, 'base_filters': 128, 'filter_growth': 'linear', 'kernel_size': 13, 'dropout': 0.23327053982788365, 'reverse_dilation': False, 'batch_size': 8, 'learning_rate': 4.2799526464941115e-05, 'weight_decay': 4.0834785890017314e-06, 'optimizer': 'AdamW', 'use_augmentation': False, 'use_scheduler': False}. Best is trial 11 with value: 1.0.

Trial 165 finished with F1 Score: 1.0000
[I 2025-11-18 12:12:46,944] Trial 166 pruned. 

Trial 166 finished with F1 Score: 0.2167
[I 2025-11-18 12:16:52,878] Trial 167 pruned. 

Trial 167 finished with F1 Score: 0.8799
[I 2025-11-18 12:19:10,616] Trial 168 pruned. 

Trial 168 finished with F1 Score: 0.0478
[I 2025-11-18 12:23:16,917] Trial 169 pruned. 

Trial 169 finished with F1 Score: 0.7454
[I 2025-11-18 12:25:01,913] Trial 170 pruned. 

Trial 170 finished with F1 Score: 0.3539
[I 2025-11-18 12:29:07,571] Trial 171 pruned. 

Trial 171 finished with F1 Score: 0.8799
[I 2025-11-18 12:34:00,085] Trial 172 pruned. 

Trial 172 finished with F1 Score: 0.9195
[I 2025-11-18 12:38:05,481] Trial 173 pruned. 

Trial 173 finished with F1 Score: 0.8873
[I 2025-11-18 12:42:11,451] Trial 174 pruned. 

Trial 174 finished with F1 Score: 0.8165
[I 2025-11-18 12:46:17,929] Trial 175 pruned. 

Trial 175 finished with F1 Score: 0.8324
[I 2025-11-18 12:49:00,226] Trial 176 pruned. 

Trial 176 finished with F1 Score: 0.7388
[I 2025-11-18 12:58:34,512] Trial 177 finished with value: 1.0 and parameters: {'num_layers': 7, 'base_filters': 128, 'filter_growth': 'linear', 'kernel_size': 13, 'dropout': 0.22650134901667682, 'reverse_dilation': False, 'batch_size': 8, 'learning_rate': 2.948457341884451e-05, 'weight_decay': 0.00018489142331678857, 'optimizer': 'AdamW', 'use_augmentation': False, 'use_scheduler': False}. Best is trial 11 with value: 1.0.

Trial 177 finished with F1 Score: 1.0000
[I 2025-11-18 13:08:28,973] Trial 178 finished with value: 1.0 and parameters: {'num_layers': 7, 'base_filters': 128, 'filter_growth': 'linear', 'kernel_size': 13, 'dropout': 0.26908354359192144, 'reverse_dilation': False, 'batch_size': 8, 'learning_rate': 5.061076379454026e-05, 'weight_decay': 0.0002511192220070212, 'optimizer': 'AdamW', 'use_augmentation': False, 'use_scheduler': False}. Best is trial 11 with value: 1.0.

Trial 178 finished with F1 Score: 1.0000
[I 2025-11-18 13:12:50,631] Trial 179 pruned. 

Trial 179 finished with F1 Score: 0.0807
[I 2025-11-18 13:13:55,755] Trial 180 pruned. 

Trial 180 finished with F1 Score: 0.2983
[I 2025-11-18 13:26:55,983] Trial 181 finished with value: 1.0 and parameters: {'num_layers': 7, 'base_filters': 128, 'filter_growth': 'linear', 'kernel_size': 13, 'dropout': 0.2923724378433518, 'reverse_dilation': False, 'batch_size': 8, 'learning_rate': 3.298854805397033e-05, 'weight_decay': 0.00020928963961643063, 'optimizer': 'AdamW', 'use_augmentation': False, 'use_scheduler': False}. Best is trial 11 with value: 1.0.

Trial 181 finished with F1 Score: 1.0000
[I 2025-11-18 13:31:00,889] Trial 182 pruned. 

Trial 182 finished with F1 Score: 0.8604
[I 2025-11-18 13:35:06,313] Trial 183 pruned. 

Trial 183 finished with F1 Score: 0.8289
[I 2025-11-18 13:48:40,839] Trial 184 finished with value: 1.0 and parameters: {'num_layers': 7, 'base_filters': 128, 'filter_growth': 'linear', 'kernel_size': 13, 'dropout': 0.28637314369312594, 'reverse_dilation': False, 'batch_size': 8, 'learning_rate': 3.573008428907892e-05, 'weight_decay': 0.00045183212191421244, 'optimizer': 'AdamW', 'use_augmentation': False, 'use_scheduler': False}. Best is trial 11 with value: 1.0.

Trial 184 finished with F1 Score: 1.0000
[I 2025-11-18 13:53:44,074] Trial 185 pruned. 

Trial 185 finished with F1 Score: 0.9297
[I 2025-11-18 13:57:48,565] Trial 186 pruned. 

Trial 186 finished with F1 Score: 0.6327
[I 2025-11-18 13:58:16,805] Trial 187 pruned. 

Trial 187 finished with F1 Score: 0.3437
[I 2025-11-18 14:02:11,370] Trial 188 pruned. 

Trial 188 finished with F1 Score: 0.6674
[I 2025-11-18 14:02:34,755] Trial 189 pruned. 

Trial 189 finished with F1 Score: 0.3447
[I 2025-11-18 14:07:01,268] Trial 190 pruned. 

Trial 190 finished with F1 Score: 0.9070
[I 2025-11-18 14:11:07,062] Trial 191 pruned. 

Trial 191 finished with F1 Score: 0.8048
[I 2025-11-18 14:15:13,396] Trial 192 pruned. 

Trial 192 finished with F1 Score: 0.9032
[I 2025-11-18 14:24:46,213] Trial 193 finished with value: 1.0 and parameters: {'num_layers': 7, 'base_filters': 128, 'filter_growth': 'linear', 'kernel_size': 13, 'dropout': 0.22719656623493303, 'reverse_dilation': False, 'batch_size': 8, 'learning_rate': 3.1158968534714305e-05, 'weight_decay': 0.002447539394495196, 'optimizer': 'AdamW', 'use_augmentation': False, 'use_scheduler': False}. Best is trial 11 with value: 1.0.

Trial 193 finished with F1 Score: 1.0000
[I 2025-11-18 14:28:51,780] Trial 194 pruned. 

Trial 194 finished with F1 Score: 0.8136
[I 2025-11-18 14:32:57,484] Trial 195 pruned. 

Trial 195 finished with F1 Score: 0.8282
[I 2025-11-18 14:37:03,417] Trial 196 pruned. 

Trial 196 finished with F1 Score: 0.9110
[I 2025-11-18 14:41:09,598] Trial 197 pruned. 

Trial 197 finished with F1 Score: 0.7330
[I 2025-11-18 14:45:15,143] Trial 198 pruned. 

Trial 198 finished with F1 Score: 0.8077
[I 2025-11-18 14:49:20,233] Trial 199 pruned. 

Trial 199 finished with F1 Score: 0.9110

================================================================================
OPTIMIZATION COMPLETE
================================================================================

Number of finished trials: 200

--------------------------------------------------------------------------------
BEST TRIAL
--------------------------------------------------------------------------------
  Trial number: 11
  Macro F1 Score: 1.0000

  Best Hyperparameters:
    num_layers: 7
    base_filters: 128
    filter_growth: linear
    kernel_size: 13
    dropout: 0.1991194578395904
    reverse_dilation: False
    batch_size: 8
    learning_rate: 5.30273463951994e-05
    weight_decay: 1.5396967697445294e-05
    optimizer: AdamW
    use_augmentation: False
    use_scheduler: False

  Statistics:
    Complete trials: 77
    Pruned trials: 123

--------------------------------------------------------------------------------
TOP 10 TRIALS
--------------------------------------------------------------------------------
1. Trial 11: F1 = 1.0000
2. Trial 13: F1 = 1.0000
3. Trial 23: F1 = 1.0000
4. Trial 24: F1 = 1.0000
5. Trial 25: F1 = 1.0000
6. Trial 31: F1 = 1.0000
7. Trial 33: F1 = 1.0000
8. Trial 42: F1 = 1.0000
9. Trial 51: F1 = 1.0000
10. Trial 52: F1 = 1.0000

--------------------------------------------------------------------------------
HYPERPARAMETER IMPORTANCE
--------------------------------------------------------------------------------
  kernel_size: 0.3824
  num_layers: 0.3625
  optimizer: 0.1057
  base_filters: 0.0522
  batch_size: 0.0283
  dropout: 0.0210
  learning_rate: 0.0177
  use_augmentation: 0.0113
  reverse_dilation: 0.0068
  use_scheduler: 0.0063
  filter_growth: 0.0032
  weight_decay: 0.0027

================================================================================
RESULTS SAVED TO DATABASE
================================================================================
Database location: optuna_tcn_study.db
Study name: tcn_shark_classification

To visualize results, use Optuna Dashboard:
  pip install optuna-dashboard
  optuna-dashboard sqlite:///optuna_tcn_study.db
================================================================================

Best hyperparameters also saved to: best_hyperparameters.json
Job finished at: Tue 18 Nov 2025 02:49:21 PM EST
